name,address,city,district
萬達寵物事業股份有限公司內湖康樂分公司,臺北市內湖區康樂街116之3號1樓,臺北市,內湖區
星沐精緻寵物美容,臺北市松山區民權東路三段156號1樓,臺北市,松山區
九能寵物用品有限公司,臺北市中山區林森北路413號8樓之21,臺北市,中山區
東森寵物雲股份有限公司,臺北市士林區文林路66號1樓,臺北市,士林區
東森寵物雲股份有限公司通化分公司,臺北市大安區通化街26之7號1樓,臺北市,大安區
咘咘寵物生活坊,新北市中和區中和區安平路64號,新北市,中和區
老闆家貓舍,桃園市桃園區大仁路32號1樓,桃園市,桃園區
我最重要的寵物館,臺中市沙鹿區興安路12號1樓,臺中市,沙鹿區
宅貓寓所貓旅館,新北市中和區中山路3段20號1樓,新北市,中和區
惦記寵物美容,臺南市安南區公學路二段275巷68號,臺南市,安南區
珈寶貝寵物店,高雄市大寮區鳳屏一路185巷2號,高雄市,大寮區
英倫王子悠閒時光工作室,臺中市西屯區逢甲路227之1號,臺中市,西屯區
歐米菲寵物沙龍旅館,臺中市霧峰區四德路228號1樓、2樓,臺中市,霧峰區
柴柴家,桃園市龜山區迴龍里龍鳳街29巷9號,桃園市,龜山區
萬達寵物事業股份有限公司_仁武仁忠分公司,高雄市仁武區仁忠路149號,高雄市,仁武區
咖啡貓犬舍,臺南市永康區埔園里37鄰永大路三段453號1樓,臺南市,永康區
珊寶寵物店,臺中市北屯區松義街146號,臺中市,北屯區
藝淋寵物美容坊,臺中市西屯區西屯路三段159之11巷1號,臺中市,西屯區
貓膩會館,高雄市鼓山區明誠四路112號1樓,高雄市,鼓山區
寶寶好宅寵物生活館,臺中市北屯區北平路四段100號1樓,臺中市,北屯區
苗琳寵物沙龍,桃園市龜山區桃園市龜山區中興里萬壽路二段1209-2號1樓,桃園市,龜山區
大爺股份有限公司,臺北市內湖區民權東路六段170號1、2樓,臺北市,內湖區
東森寵物雲股份有限公司小港宏平分公司,高雄市小港區宏平路432、434號,高雄市,小港區
撩貓逗狗寵物生活坊,桃園市平鎮區廣興里延平路二段28號,桃園市,平鎮區
東森寵物雲股份有限公司東區中華東分公司,臺南市東區中華東路三段193號,臺南市,東區
懶狗狗寵物沙龍,高雄市楠梓區右昌街124號,高雄市,楠梓區
東森寵物雲股份有限公司楠梓興楠分公司,高雄市楠梓區興楠路60號,高雄市,楠梓區
東森寵物雲股份有限公司小港桂陽分公司,高雄市小港區桂陽路115號,高雄市,小港區
東森寵物雲股份有限公司苓雅大順分公司,高雄市苓雅區大順三路218號1樓,高雄市,苓雅區
萬福寵物商行,高雄市前鎮區二聖二路16號1樓、2樓,高雄市,前鎮區
萬達寵物事業股份有限公司內壢文化分公司,桃園市中壢區復興里文化二路95號,桃園市,中壢區
旺達寵物生活館,臺中市北屯區東山路二段141號1、2樓,臺中市,北屯區
喵德渡假貓旅館,桃園市桃園區南華里南華街93巷41號1樓,桃園市,桃園區
卷毛寵物沙龍,高雄市鳳山區文藝街58號,高雄市,鳳山區
東森寵物雲股份有限公司佳里新生分公司,臺南市佳里區建南里5鄰新生路357號,臺南市,佳里區
東森寵物雲股份有限公司新營民生分公司,臺南市新營區新北里2鄰民生路167號,臺南市,新營區
東森寵物雲股份有限公司台南關廟分公司,臺南市關廟區南雄路二段462號,臺南市,關廟區
東森寵物雲股份有限公司仁德中山分公司,臺南市仁德區仁義里22鄰中山路491號1樓,臺南市,仁德區
萬達寵物事業股份有限公司高雄美術分公司,高雄市鼓山區明誠四路112號2樓,高雄市,鼓山區
剪刀手寵物美容沙龍,臺中市北區崇德路一段474號,臺中市,北區
晴虹貓咪美容有限公司,臺中市南區南陽街90號1樓、2樓,臺中市,南區
御達寵物店,臺中市北區梅川西路四段185號,臺中市,北區
旺將寵物精品沙龍店,臺中市北區大仁街62號1樓,臺中市,北區
比比狗寵物旅宿,臺中市豐原區豐東路382號2樓,臺中市,豐原區
朵樂詩寵物美容店,臺中市北屯區景和街346號1樓,臺中市,北屯區
白金寵物店,臺南市佳里區六安里2鄰進學路16號,臺南市,佳里區
東森寵物雲股份有限公司前鎮瑞隆分公司,高雄市前鎮區瑞隆路401號,高雄市,前鎮區
樂曖貓狗生活館,臺中市南區忠孝路3號,臺中市,南區
萬達寵物事業股份有限公司台中太平分公司,臺中市太平區臺中市太平區樹孝路8之4號1樓,臺中市,太平區
沐貓工作坊,高雄市苓雅區武昌路70巷71號1樓,高雄市,苓雅區
韋米雲樂寵物生活用品店,臺中市西區精誠九街10號,臺中市,西區
毛孩你好寵物生活館,臺中市南屯區益昌二街111號2樓,臺中市,南屯區
澄佳開發有限公司,臺中市南屯區東興路一段475號1樓,臺中市,南屯區
鸚粹斯特工作坊,臺南市後壁區頂安里6鄰頂寮105號之24,臺南市,後壁區
相信貓科技有限公司,桃園市龜山區樂善一路5號2樓,桃園市,龜山區
亞威寵物館,高雄市茄萣區高雄市茄萣區濱海路二段78巷12號,高雄市,茄萣區
寵物愛達人用品企業社,臺北市松山區八德路四段174號1樓,臺北市,松山區
毛孩愛達人用品企業社,臺北市松山區健康路260號1樓,臺北市,松山區
阿曼達寵物旅館,桃園市平鎮區金星里上海路311號,桃園市,平鎮區
糖狗屋寵物生活館,臺南市新營區民權里2鄰中山路174號,臺南市,新營區
貓躍寵物工作室,臺中市東區自強南街5巷32號1樓、2樓,臺中市,東區
夏克貝迪寵物有限公司,臺中市北區文昌東二街11號,臺中市,北區
幸福貓村貓旅館,臺中市北屯區大連路一段198號1樓,臺中市,北屯區
老蘇傷殘老狗安養社,高雄市鳥松區松埔北巷4-68號,高雄市,鳥松區
熊樣寵物旅館,高雄市鼓山區明誠三路600號1樓,高雄市,鼓山區
大柴小熊寵物美容,臺中市北屯區平德路82巷5號1樓,臺中市,北屯區
啾啾寵物美容店,臺中市北屯區松竹路二段383之5號1樓,臺中市,北屯區
東森寵物雲股份有限公司台南新市分公司,臺南市新市區新市里中正路365號,臺南市,新市區
東森寵物雲股份有限公司臺中沙鹿分公司,臺中市沙鹿區臺灣大道七段279號、281號,臺中市,沙鹿區
霏霏寵物度假會館,臺中市北屯區和福路66號2樓,臺中市,北屯區
嘟比寵物沙龍,臺中市西屯區國安一路39號,臺中市,西屯區
黃金時代寵物美容坊,臺中市南屯區大墩十四街181號,臺中市,南屯區
圓圓愛犬屋,臺中市北區中清路一段210號1樓,臺中市,北區
汪大爺寵物美容館,臺中市東區大振街30號1樓,臺中市,東區
阿布寵物生活館,臺南市永康區復華里35鄰復國一路461號,臺南市,永康區
毛宅一起寵物美容旅店,桃園市大園區桃園市大園區田心里華興路一段13號,桃園市,大園區
歐品邁國際有限公司,臺北市中山區明水路672巷36號1樓,臺北市,中山區
跨樂提有限公司,臺北市松山區八德路二段429號2-4樓,臺北市,松山區
星安貓寵物旅館,新北市永和區環河東路1段76號1樓,新北市,永和區
東森寵物雲股份有限公司鳳山青年分公司,高雄市鳳山區青年路二段62之5號,高雄市,鳳山區
東森寵物雲股份有限公司前金自立分公司,高雄市前金區自立二路91、93號,高雄市,前金區
北歐犬舍有限公司,臺北市大安區新生南路二段60之1和60之2號,臺北市,大安區
呼嚕踏踏貓舍,高雄市鳳山區文化西路34號1、2樓,高雄市,鳳山區
咪粿商行,臺中市西屯區福雅路128巷65號1樓、4樓,臺中市,西屯區
迦恩寵物造型坊,臺中市潭子區福潭路507巷1號1樓,臺中市,潭子區
奧迪奧寵物生活旅宿(犬),臺中市北屯區北屯路281之3號2樓,臺中市,北屯區
洗狗吧寵物美容工作坊,臺中市西區大業路22號1樓、地下1樓,臺中市,西區
普奇寵物企業社,臺北市中山區長安東路二段195號1樓,臺北市,中山區
米特寵物美容旅店,高雄市楠梓區惠正街145號,高雄市,楠梓區
萬達寵物事業股份有限公司高雄新興分公司,高雄市新興區高雄市新興區復興一路19號及2樓之1至2樓之3,高雄市,新興區
點點屋寵物美容坊,臺中市北屯區太原路三段1387號1樓,臺中市,北屯區
寄居喵精品貓宿,臺北市信義區信義路四段401號5樓,臺北市,信義區
儷登愛犬美容工作室,臺中市西區精誠路227號1樓,臺中市,西區
東森寵物雲股份有限公司西屯青海分公司,臺中市西屯區青海路二段225號,臺中市,西屯區
寵尼寵物澡堂,臺中市大甲區開元路11巷8之2號1樓、2樓,臺中市,大甲區
沐新犬貓坊,臺北市大安區基隆路二段120號1樓,臺北市,大安區
八比比寵物,臺中市北屯區文昌三街67號1樓,臺中市,北屯區
金利海貿易有限公司,高雄市楠梓區大學十一街312號,高雄市,楠梓區
琦琦寵物生活館,高雄市旗山區復新街28號,高雄市,旗山區
九零一寵物美容,桃園市桃園區新埔里經國路221號,桃園市,桃園區
金狗錐狗狗商行,臺北市松山區南京東路五段163-4號1樓,臺北市,松山區
搖擺狗寵物美容店,臺北市信義區光復南路417-4號,臺北市,信義區
樓上遇見貓咖啡,臺北市松山區光復北路38號2樓,臺北市,松山區
禮來寵物生活館,臺北市大安區基隆路二段144巷2號1樓,臺北市,大安區
愛貓寒舍有限公司,臺北市大安區基隆路二段110號5樓,臺北市,大安區
狗狗好乖企業社,臺北市南港區玉成街4號1樓,臺北市,南港區
五號寵物店,臺北市內湖區內湖路一段737巷8弄14號1樓,臺北市,內湖區
沐娜寵物生活館,桃園市觀音區草漯里長興路230號1樓,桃園市,觀音區
豪斯寵物服務有限公司(Gu Gu House 寵物旅館),臺北市中山區敬業一路160號,臺北市,中山區
哈荳米比商行,臺北市內湖區內湖路二段376巷12號1樓,臺北市,內湖區
毛尾巴商行,臺北市大安區大安路一段205號1樓,臺北市,大安區
冠佳犬社,桃園市大園區田心里和平西路168號1樓,桃園市,大園區
均禾貓旅館,桃園市桃園區莊敬里新埔七街168巷12號1樓,桃園市,桃園區
傑士宇企業社,臺中市太平區育德路192號1樓,臺中市,太平區
萬達寵物事業股份有限公司八德興豐分公司,桃園市八德區興豐里興豐路485號,桃園市,八德區
日光森林寵物旅館,臺中市西區柳川西路二段24號3樓,臺中市,西區
愛美狗寵物美容館,臺中市西屯區西屯路二段30之2號1樓,臺中市,西屯區
富匠寵物生活館,高雄市左營區至聖路73號,高雄市,左營區
囍狗寵物,桃園市楊梅區雙榮里民族路五段241號,桃園市,楊梅區
蘋果寵物美容館,桃園市楊梅區瑞塘里梅獅路二段499號,桃園市,楊梅區
源香寵物旅館,臺南市南區金華路二段57巷10號,臺南市,南區
菲麗寵物美容室,桃園市楊梅區楊江里新農街6之8號,桃園市,楊梅區
吉霸寵物美容沙龍,臺南市官田區二鎮里13鄰工社北街62號1樓,臺南市,官田區
好有商行,臺中市西區博館路213號2樓,臺中市,西區
艾希艾貓旅社,臺中市西區美村路一段93號3樓,臺中市,西區
誕生貓舍,高雄市三民區大豐二路372號1、2樓,高雄市,三民區
貝寵閣寵物生活館,高雄市三民區建國二路157號1、2樓,高雄市,三民區
喵嗚貓咪旅館,桃園市桃園區福安里昆明路250號,桃園市,桃園區
貝菓寵物美宿館,桃園市蘆竹區福昌里忠孝西路175巷17號,桃園市,蘆竹區
晶鑽寵物旅館,新北市淡水區新北市淡水區坪頂路39-1號1樓,新北市,淡水區
北鼻精品生活館,新北市林口區中山路65號,新北市,林口區
友狗寵物沙龍店,臺中市神岡區大漢街49號1樓,臺中市,神岡區
念慈有限公司,臺中市北屯區昌平路一段304號3樓、4樓,臺中市,北屯區
東森寵物雲股份有限公司豐原圓環東分公司,臺中市豐原區圓環東路257號1樓,臺中市,豐原區
萬達寵物事業股份有限公司台南新市分公司,臺南市新市區新市區新和里3鄰中正路39、39之1、41號,臺南市,新市區
洣倪寵物生活館,臺中市西區精誠二十三街16號1樓,臺中市,西區
曖豆寵物造型沙龍,臺中市太平區大源路20之17號1樓,臺中市,太平區
太樸寵物生活館,桃園市中壢區普仁里中北路51號1樓,桃園市,中壢區
舞颯琪企業社,桃園市中壢區仁祥里華安路44號,桃園市,中壢區
小鑫鑫寵物沙龍,臺中市梧棲區永寧路67巷60之3號1樓,臺中市,梧棲區
漂亮寶貝動物用品社,高雄市旗山區延平二路121號,高雄市,旗山區
小森林純貓美容旅館,桃園市八德區興仁里豐德路326號,桃園市,八德區
悠遊狗寵物生活館,桃園市大園區橫峰里致祥三街36號1及2樓,桃園市,大園區
泰迪寵物沙龍,桃園市大園區田心里和平西路156號,桃園市,大園區
狗宿喜有限合夥,臺南市南區南門路341-4號1-2樓,臺南市,南區
中圓寵物股份有限公司中原二館分公司,桃園市中壢區普強里中山東路二段16號,桃園市,中壢區
法拉利愛犬美容屋,高雄市鳳山區南正二路135號,高雄市,鳳山區
自在沐寵物美容工作室,臺中市北區博館路70號1樓,臺中市,北區
河童寵物部屋,臺南市永康區正強里9鄰自強路296號1樓,臺南市,永康區
香郊遊寵物美容,臺南市安南區安南區國安街210巷22號,臺南市,安南區
萬達寵物事業股份有限公司中原分公司,桃園市中壢區普強里中山東路二段1號,桃園市,中壢區
東森寵物雲股份有限公司楠梓梓新分公司,高雄市楠梓區楠梓新路99號、101號1樓,高雄市,楠梓區
歐哈娜寵窩沙龍,高雄市仁武區八德西路1850號,高雄市,仁武區
宜鴻商行,高雄市鼓山區中華一路2220號,高雄市,鼓山區
東森寵物雲股份有限公司路竹中山分公司,高雄市路竹區中山路1205、1207、1209號,高雄市,路竹區
東森寵物雲股份有限公司岡山柳橋分公司,高雄市岡山區柳橋西路6、10號,高雄市,岡山區
享時生活有限公司,臺中市北屯區景賢路103號1樓、2樓,臺中市,北屯區
捷勝犬舍,桃園市中壢區自治里強國路53巷12號3樓,桃園市,中壢區
豆貓殿堂,臺南市新營區新營區新東里25鄰東興路135號1樓,臺南市,新營區
喵小二貓咪旅館,臺南市北區北區大港街93號,臺南市,北區
富達易企業社,高雄市三民區建工路802號,高雄市,三民區
魔斯凱歐寵物沙龍,臺中市南屯區黎明東街390號1樓,臺中市,南屯區
沐樂寵物澡堂,臺中市大里區永隆路63號1樓,臺中市,大里區
魚中魚樂活有限公司民族分公司,高雄市三民區民族一路610、612號,高雄市,三民區
貓掌星雲地球總部有限公司,新北市八里區新北市八里區觀海大道95號1樓,新北市,八里區
新八寵物美容,臺中市北屯區松竹路二段215號1樓,臺中市,北屯區
百威犬舍,桃園市大園區溪海里3鄰溪洲路69巷70號(溪海里3鄰下溪洲子21-3號門牌整編),桃園市,大園區
棉花田寵物商行,桃園市蘆竹區上竹里大竹路426之8號1樓,桃園市,蘆竹區
東森寵物雲股份有限公司三民建工分公司,高雄市三民區建工路351號1、2樓,高雄市,三民區
汪汪犬旅寵物旅館,臺中市北屯區松竹路二段361號3樓,臺中市,北屯區
沐森琳寵物商行,臺中市北區梅亭街490號,臺中市,北區
愛樂寵物店,臺中市南屯區向心南路730號1樓,臺中市,南屯區
喬樂彼犬貓沙龍坊,新北市汐止區明峰街129號1樓,新北市,汐止區
狗狗你好寵物美容,臺中市東區進化路272-5號1樓,臺中市,東區
東森寵物雲股份有限公司仁武仁雄分公司,高雄市仁武區仁雄路33號,高雄市,仁武區
華貴皇族國際專業貓舍,新北市中和區秀朗路3段128巷9弄11號1樓,新北市,中和區
樂維格寵物生活工作室,臺中市北區太原路二段203號,臺中市,北區
牛棚寵物沙龍,桃園市中壢區東興里龍岡路一段94號,桃園市,中壢區
東森寵物雲股份有限公司高雄十全分公司,高雄市三民區十全二路114、116號,高雄市,三民區
琥珀貓舍,桃園市楊梅區埔心里興南街40號,桃園市,楊梅區
東森寵物雲股份有限公司永康中華分公司,臺南市永康區安康里15鄰中華路651、653、657號,臺南市,永康區
東森寵物雲股份有限公司南區新興分公司,臺南市南區新興路509號之2及509號之3,臺南市,南區
東森寵物雲股份有限公司善化光復分公司,臺南市善化區文昌里7鄰光復路66號1樓,臺南市,善化區
東森寵物雲股份有限公司安南海佃分公司,臺南市安南區海佃路二段58、60、62、66號1樓,臺南市,安南區
東森寵物雲股份有限公司安平建平分公司,臺南市安平區建平路271號1樓,臺南市,安平區
東森寵物雲股份有限公司北區西門分公司,臺南市北區西門路四段268號,臺南市,北區
優有寵物美容生活館,臺南市安平區建平四街18巷18弄12號,臺南市,安平區
沐居寵物精緻美容,臺南市新營區臺南市新營區埤寮里6鄰中正路500巷86號1樓,臺南市,新營區
咪谷貓旅館,臺中市西區福人街44巷2號1樓,臺中市,西區
彩虹魚寵物水族百貨館,桃園市桃園區同安里大興西路一段221號1樓,桃園市,桃園區
中圓寵物股份有限公司南崁分公司,桃園市蘆竹區錦中里南崁路361號1樓,桃園市,蘆竹區
達特歐寵物旅館,桃園市大園區五權里五青路183巷53號,桃園市,大園區
金冠霖寵物有限公司,桃園市蘆竹區錦中里南崁路一段24號1樓,桃園市,蘆竹區
好萌好猛寵物有限公司,桃園市中壢區洽溪里永泰路151號,桃園市,中壢區
寵貝比寵物沙龍,桃園市桃園區春日里大業路 二段137號1樓,桃園市,桃園區
親龍水族企業社,桃園市蘆竹區長興里南崁路一段284號,桃園市,蘆竹區
九福寵物店,桃園市桃園區朝陽里民生路464號,桃園市,桃園區
好萌商行,桃園市平鎮區金陵里11鄰振平街221號,桃園市,平鎮區
芭比寵物坊,桃園市桃園區東埔里正康二街103號,桃園市,桃園區
喜喜商行,臺中市西區五權七街206號1樓,臺中市,西區
寶育愛犬訓練場,臺中市大里區塗城路171巷2號1樓,臺中市,大里區
魚中魚樂活有限公司大墩分公司,臺中市南屯區文心路一段385號1樓,臺中市,南屯區
小森林寵物旅館,桃園市平鎮區義民里環南路二段28號,桃園市,平鎮區
毛毛屋寵物美容,臺中市北屯區臺中市北屯區大連路三段191號,臺中市,北屯區
宏昇美容坊,高雄市鳳山區五甲二路592號1樓,高雄市,鳳山區
樂逗寵物美容店,臺中市太平區大興路178號1樓,臺中市,太平區
杏芙貓舍,臺南市永康區台南市永康區大橋里1鄰大橋三街77號,臺南市,永康區
佐佐瑪莉寵物沙龍,臺南市安平區民權路四段381之8號,臺南市,安平區
凱凱寵物生活館,臺南市中西區中西區西門路二段39號,臺南市,中西區
凡采寵物坊,臺中市清水區中清路九段508號1樓、2樓,臺中市,清水區
晨露森林寵物旅店,臺中市清水區槺榔里民族路三段117號,臺中市,清水區
日光寵物旅館,高雄市仁武區大正路312號1樓,高雄市,仁武區
林緁寵物生活館,高雄市鳳山區頂興街211號1樓,高雄市,鳳山區
犬家福寵物精品店,桃園市桃園區中成里永安路409號1樓,桃園市,桃園區
狗的窩企業社,高雄市三民區遼寧三街93號1樓,高雄市,三民區
努塔波企業社,新北市板橋區仁化街42巷5弄1號1樓,新北市,板橋區
屋萀貓企業社,新北市三重區自強路1段312巷11號,新北市,三重區
佐欣寵物工坊,高雄市仁武區仁光路72號,高雄市,仁武區
歐藤寵物沙龍,臺中市西區模範街35之2號1樓,臺中市,西區
魚中魚樂活有限公司南屯分公司,臺中市南屯區五權西路二段80號1樓,臺中市,南屯區
豆丁寵物美學沙龍,桃園市桃園區大業路二段245號,桃園市,桃園區
家有毛孩有限公司,桃園市桃園區保定三街89巷1號,桃園市,桃園區
孩要有你寵物沙龍,桃園市桃園區敬二街23號,桃園市,桃園區
甜媽幸福寵物,桃園市八德區高明里高城五街22巷5弄3號,桃園市,八德區
香腳ㄚ寵物工坊,高雄市前鎮區武慶一路234號1樓,高雄市,前鎮區
貓花園工作室,臺中市南區美村路二段172號1樓,臺中市,南區
樂芙倪精品寵物旅館,臺南市東區裕忠路128之3號,臺南市,東區
狗崽子寵物沙龍,臺北市北投區中央南路一段42-1號2樓,臺北市,北投區
秋鳳莊寵物店,臺中市烏日區溪南路一段126巷91弄52號1樓,臺中市,烏日區
意勛寵物綜合服務,高雄市前鎮區梧州街30巷7號,高雄市,前鎮區
小沐浴寵物美容坊,桃園市中壢區桃園市中壢區洽溪里永能路3號,桃園市,中壢區
抱抱熊寵物生活館,桃園市八德區大和里建國路1134號,桃園市,八德區
吉兒溫馨貓館,桃園市桃園區桃園市桃園區忠義里民有六街12號,桃園市,桃園區
蝴蝶蘭犬舍,臺中市中區光復路10號1樓,臺中市,中區
摸肚肚企業社,桃園市中壢區青埔里青昇路256號,桃園市,中壢區
犬藝匠寵物美容沙龍,臺中市南區五權南路548號1樓,臺中市,南區
咪寶寵物坊,臺中市西屯區國際街25-1號,臺中市,西屯區
東森寵物雲股份有限公司臺中大里分公司,臺中市大里區國光路二段441號,臺中市,大里區
歆詠企業社,臺中市北區山西路一段56號1樓、2樓,臺中市,北區
岱哥寵物精品,臺北市士林區天母西路3號2樓之1,臺北市,士林區
捲毛叔叔寵物美容,桃園市中壢區環中東路二段694、696號1樓、2樓,桃園市,中壢區
璽喵屋,臺北市松山區八德路四段476號1樓,臺北市,松山區
全滿屋寵物生活館,臺北市文山區興隆路二段220巷31弄7號,臺北市,文山區
小客廳寵物事業有限公司,臺北市內湖區成功路四段30巷19號,臺北市,內湖區
愛犬當家美容屋,桃園市平鎮區金星里中庸路116巷3號,桃園市,平鎮區
喵森有限公司,臺南市東區裕農路375號地下層,臺南市,東區
夏沐沐寵物館,臺中市西屯區永福路118巷11號1樓、地下1樓,臺中市,西屯區
紡晟寵物工坊,臺中市西區五權路2-25號1樓,臺中市,西區
艾絲比寵物生活館,臺南市永康區中山東路127號1樓,臺南市,永康區
麻豆幸福種子寵物沙龍,臺南市麻豆區民生路17-1號2樓,臺南市,麻豆區
有安芯寵物生活館,臺中市太平區新興路30號,臺中市,太平區
熊熊家寵物美容,桃園市平鎮區龍興里龍美路39巷2號,桃園市,平鎮區
一期一會寵物美學旅館,桃園市中壢區過嶺里松仁路8號,桃園市,中壢區
貓貓肉寵物店,臺中市大里區自立路67號2樓,臺中市,大里區
家寶寵物店(犬),臺中市大里區內新街47-2號1樓,臺中市,大里區
花花寵物美容會館,臺中市北區三民路三段285號1樓,臺中市,北區
露娜寵物旅館,高雄市三民區義昌路42號,高雄市,三民區
悅沐寵物美容精品館,臺中市西屯區西屯路三段164之7號1樓,臺中市,西屯區
新興幸福種子寵物沙龍,臺南市南區新興路133號1-2樓,臺南市,南區
永欣寵物美容坊,臺中市西屯區福林路31號1樓,臺中市,西屯區
黑馬寵物美容,高雄市前鎮區崗山西街295號,高雄市,前鎮區
海灣樂世界股份有限公司,臺中市北屯區東山路二段151之2號1樓、2樓,臺中市,北屯區
查克音國際有限公司,臺中市西區臺灣大道二段311巷1弄30號,臺中市,西區
英姿愛犬美容屋,臺南市新營區臺南市新營區新進路二段85號1樓,臺南市,新營區
貓奴貓旅館,高雄市左營區文自路164號,高雄市,左營區
維緹寵物有限公司鳳松分店,高雄市鳳山區鳳松路179號1樓,高雄市,鳳山區
阿帆達寵物生活館,臺南市北區文賢路1162號1樓,臺南市,北區
真愛狗屋寵物沙龍,高雄市路竹區中興路260號,高雄市,路竹區
第寶澡堂,臺南市中西區金華路三段6號,臺南市,中西區
都在貓咪旅館,臺南市中西區民族路三段218號3樓,臺南市,中西區
王美工作室,臺中市西屯區大墩二十街92號,臺中市,西屯區
八八精緻寵物旅館,臺中市北屯區臺中市北屯區文心路三段987號1樓、2樓、3樓、4樓,臺中市,北屯區
安中寵沐殿企業社,臺南市安南區安中路一段235號,臺南市,安南區
蔓蔓寵物行號,臺南市永康區臺南市永康區小北路3-2號1樓,臺南市,永康區
四季逗企業社,臺南市東區東平路142號,臺南市,東區
東興貝貝寵物有限公司,臺中市南屯區東興路三段253號1樓、2樓,臺中市,南屯區
傑盛愛犬訓練學苑,桃園市大溪區仁愛里埔頂六街177號,桃園市,大溪區
貓均悅坊,臺中市西區忠勤街98號2樓,臺中市,西區
日安貓坊,臺中市南區文心南路821號3樓,臺中市,南區
鴻賓寵物美容之家,臺中市西區忠誠街132號1樓,臺中市,西區
和旺犬舍,新北市泰山區泰林路3段772巷17號1樓,新北市,泰山區
日光寵物,桃園市中壢區青埔里領航南路三段83-3號,桃園市,中壢區
一級棒專業寵物美容店,新北市永和區中山路1段79號1樓,新北市,永和區
莯蓉寵物美容店,臺中市北屯區瀋陽北路20號1樓,臺中市,北屯區
白襪子寵物生活館,臺中市北區國強街15號1樓,臺中市,北區
