name,address,city,district
尚悠寵物坊,新北市永和區永貞路443號1樓,新北市,永和區
蓁心好寵旅店,高雄市鳳山區新富路10號,高雄市,鳳山區
浪寶貝寵物美容,高雄市旗山區東新街58號1樓,高雄市,旗山區
寵美空間寵物美容,高雄市三民區北平二街5巷30號,高雄市,三民區
啊財那裡寵物沙龍,高雄市鳳山區大東二路143號,高雄市,鳳山區
放心寵物店,高雄市前鎮區一心一路216號,高雄市,前鎮區
寵物派對美容生活館,高雄市鳳山區自由路165-1號,高雄市,鳳山區
沐沐寵物美容,高雄市鳳山區五甲二路334號1樓,高雄市,鳳山區
貝比寵物生活館,高雄市苓雅區三多三路40號,高雄市,苓雅區
小蕃薯寵物美容工作室,高雄市楠梓區德賢路248巷11弄7號,高雄市,楠梓區
萬達寵物事業股份有限公司金龍分公司,臺北市內湖區內湖路三段3號1樓及地下1樓、5號地下1樓,臺北市,內湖區
哈利寵物精緻美容,臺北市中山區林森北路643號1樓,臺北市,中山區
就甘心寵物美容旅館,臺北市中山區新生北路二段60巷16號4樓,臺北市,中山區
俏妞寵物生活坊,臺北市南港區興中路68巷15號,臺北市,南港區
奇果寵物美容生活館,臺北市信義區永吉路30巷100號1樓,臺北市,信義區
毛小孩美寵興業有限公司,臺北市大安區信義路四段293號2樓,臺北市,大安區
有狗真好工作室,臺北市中正區中華路二段475號1樓,臺北市,中正區
吳星慧寵物生活館,臺北市中山區中山北路三段53之8號1樓,臺北市,中山區
就是貓工作坊,臺北市文山區木柵路3段85巷23弄18號1樓,臺北市,文山區
喵喵屋,臺北市松山區八德路四段618號3樓,臺北市,松山區
米香尼寵物美容店,臺北市中山區中山北路二段59巷3弄7號1樓,臺北市,中山區
小花貓寵物生活館,臺北市文山區景興路223號,臺北市,文山區
愛犬小屋,臺北市松山區民生東路五段36巷6弄5之1號1樓,臺北市,松山區
貓語花香坊,臺北市中山區復興南路一段36-2號2樓,臺北市,中山區
樂福犬寵物生活館,臺北市文山區保儀路21號,臺北市,文山區
一起寵物生活館,臺北市中正區廈門街125號一樓,臺北市,中正區
耀晟寵物坊,臺北市大安區基隆路二段130號1樓,臺北市,大安區
金吉旺寵物有限公司,臺北市大安區基隆路二段104號1樓,臺北市,大安區
慵懶貓寵物旅館,臺北市中山區新生北路三段82號1樓,臺北市,中山區
美樂蒂寵物美容用品館,臺北市士林區延平北路五段208號1樓,臺北市,士林區
吉寵企業社,臺北市大安區基隆路二段126號1樓,臺北市,大安區
端溜桃貓屋,新北市新莊區福壽街142巷15號1樓,新北市,新莊區
狗狗公園快樂狗旅館,新北市淡水區中山北路1段247巷80號1樓,新北市,淡水區
伊芯寵物有限公司,臺北市信義區和平東路三段361號1樓,臺北市,信義區
有吉寵物店,臺北市中山區龍江路200之4號1樓及2樓,臺北市,中山區
聊聊貓旅館,新北市新莊區中和街155巷30號1樓,新北市,新莊區
南京寵物坊,新北市板橋區縣民大道3段400號1樓,新北市,板橋區
貓愛貓殿堂,新北市板橋區龍泉街124巷2號,新北市,板橋區
兆綸寵物精緻旅店,新北市板橋區館前西路120號2、3樓,新北市,板橋區
酷寶貝寵物美容工作坊,新北市新莊區中和街125巷6號1樓,新北市,新莊區
萬達寵物事業股份有限公司文化分公司,新北市板橋區板橋區文化路2段501號1樓,新北市,板橋區
喵棧行,高雄市楠梓區藍昌路285號,高雄市,楠梓區
喬的貓舍,臺南市安平區育平路252號,臺南市,安平區
暖暖寵物澡堂,臺中市西區西屯路一段133-1號1樓、地下1樓,臺中市,西區
繽狗寵物生活館,高雄市三民區大豐二路403號1樓,高雄市,三民區
小狗慢慢寵物美容,臺中市北屯區松山街88號1樓,臺中市,北屯區
波米屋寵物旅館,臺中市南屯區龍富路三段251號1樓,臺中市,南屯區
泰羽旺有限公司,臺中市北屯區太原路三段1365號1樓,臺中市,北屯區
汪悠谷寵物住宿生活館,臺中市南屯區文昌街357號1樓,臺中市,南屯區
貝克漢寵物生活館,高雄市前鎮區七雄街92號1樓,高雄市,前鎮區
小犬座寵物旅館,臺南市中西區海安路一段30號,臺南市,中西區
毛茸茸寵物沙龍,臺南市安南區安和路一段41號,臺南市,安南區
幸福寵物自助澡堂舘,臺南市南區福吉二街88號,臺南市,南區
DoDo寵物沙龍旅館,桃園市觀音區桃園市觀音草漯區里德一街92號1樓,桃園市,觀音區
美露寵物旅館,高雄市三民區民本街12號,高雄市,三民區
中圓寵物股份有限公司八德分公司,桃園市八德區瑞發里介壽路二段1076號,桃園市,八德區
嚕卡毛孩工作室,高雄市前金區成功一路352號,高雄市,前金區
長鴻寵物館,新北市中和區景平路396號1樓,新北市,中和區
哈基咪寵物生活館,臺南市南區灣裡路324巷2號,臺南市,南區
茱莉寵物美容工作室,高雄市苓雅區林森二路92號,高雄市,苓雅區
狗狗好棒寵物沙龍,高雄市左營區榮總路141巷25號,高雄市,左營區
巧耘寵物美容,高雄市左營區高雄市左營區新光里新庄仔路45-4號,高雄市,左營區
狗腳印寵物工作室,高雄市仁武區仁雄路42之18號,高雄市,仁武區
狗自在家庭式寄養,高雄市苓雅區凱旋二路61號1樓2樓,高雄市,苓雅區
佩泊商行,高雄市苓雅區福德三路321號,高雄市,苓雅區
毛絨絨寵物澡堂,高雄市前鎮區民權二路613號,高雄市,前鎮區
星寵閣企業社,高雄市左營區至聖路306號,高雄市,左營區
毛小窩寵物生活館,高雄市三民區龍江街47巷18號2樓,高雄市,三民區
狗妹妹寵物坊,高雄市鳳山區五權路25號,高雄市,鳳山區
狗太陽寵物精品沙龍,高雄市前金區光復一街32號,高雄市,前金區
歐比寵物生活館,高雄市前鎮區二聖一路87號,高雄市,前鎮區
樂寵窩寵物美容,高雄市鼓山區青松街25號,高雄市,鼓山區
魚中魚樂活有限公司華夏分公司,高雄市左營區華夏路1340號,高雄市,左營區
丹紫京寵物沙龍坊,高雄市楠梓區樂群路198號,高雄市,楠梓區
泡泡沐寵物沙龍旅館,高雄市鳳山區北昌三街102號1樓,高雄市,鳳山區
渵屋創意工作室,高雄市鳳山區新昌街32號,高雄市,鳳山區
家蓁寵物美容,高雄市鳳山區新生街一段17號1樓,高雄市,鳳山區
沐町寵物美容生活館,高雄市三民區覺民路25號1樓,高雄市,三民區
喵窩企業社,高雄市岡山區大仁北路121巷1弄29-2號1、2樓,高雄市,岡山區
法鬥學園犬舍,高雄市橋頭區佛神路13號,高雄市,橋頭區
奈斯澎澎寵物沙龍,高雄市前鎮區高雄市前鎮區永豐路107號,高雄市,前鎮區
祝妮皮安企業社,高雄市苓雅區武漢街113-4號,高雄市,苓雅區
品宇寵物綜合服務,高雄市左營區重立路232巷21號,高雄市,左營區
豬窩寵物沙龍旅館,高雄市三民區興昌街26號,高雄市,三民區
初心寵物美容,高雄市左營區重信路391號1樓,高雄市,左營區
之勁商行,高雄市前鎮區文林街43號,高雄市,前鎮區
八八寵物沙龍館,高雄市三民區大慶街88號,高雄市,三民區
汪汪掀被寵物沙龍,高雄市鳳山區北文街92號1樓,高雄市,鳳山區
帕菲犬貓園,新北市新莊區新北大道7段726號1樓,新北市,新莊區
珍寶寵物沙龍,高雄市鳳山區新康街185號1樓,高雄市,鳳山區
萬達寵物事業股份有限公司_青年分公司,高雄市鳳山區青年路二段450、452號,高雄市,鳳山區
迷妳寵物店,高雄市新興區復興一路14之3號,高雄市,新興區
愛沐貓旅館,高雄市新興區民生一路14號,高雄市,新興區
丹晅寵物沙龍旅館,高雄市鳳山區高雄市鳳山區海涵路492號,高雄市,鳳山區
勤喬有限公司,高雄市三民區察哈爾一街9號,高雄市,三民區
一叁六寵物美容,高雄市鼓山區華豐街71號,高雄市,鼓山區
棉花糖寵物生活坊,高雄市岡山區岡山南路1巷21號1、2樓,高雄市,岡山區
朵妮寵物創意美學館,高雄市小港區高雄市小港區新昌街26-8號1樓,高雄市,小港區
棉花糖寵物旅館,高雄市美濃區光明路169號,高雄市,美濃區
毛逗寵物精品沙龍,高雄市左營區明華一路11號,高雄市,左營區
米妮美樂寵物沙龍,高雄市左營區民族一路1182號,高雄市,左營區
緣真寵物名店,高雄市美濃區中正路二段75號,高雄市,美濃區
原野登山體育社,高雄市左營區後昌路605號,高雄市,左營區
熊大心寵物精品旅館,高雄市鼓山區鼓山二路110號,高雄市,鼓山區
貓米設計寵物背包客工作室,高雄市鳳山區高雄市鳳山區五甲三路295巷85號,高雄市,鳳山區
寵悠活鮮食宿,高雄市左營區廍後街10之1號1樓,高雄市,左營區
小太陽寵物美容,高雄市鳳山區文聖街126號,高雄市,鳳山區
五吉寵物旅館,高雄市大寮區永仁街18號,高雄市,大寮區
我的狗寵物美容住宿,高雄市三民區高雄市三民區民族一路525號,高雄市,三民區
寵物王朝有限公司大社分公司,高雄市大社區旗楠路88號,高雄市,大社區
幸運草寵物美容,高雄市前鎮區二聖二路13號,高雄市,前鎮區
喵起來住館,高雄市新興區復興二路344號2樓,高雄市,新興區
我與狗寵物旅館,高雄市小港區桂陽路175巷1弄23號,高雄市,小港區
沛思寵物沙龍,高雄市鼓山區青海路340號,高雄市,鼓山區
杜魯爸爸寵物美容,高雄市鳳山區高雄市鳳山區建國路三段267巷30號,高雄市,鳳山區
萬達寵物事業股份有限公司高雄岡山分公司,高雄市岡山區高雄市岡山區岡燕路40、42號及高雄市岡山區民有路44、46號,高雄市,岡山區
塔塔寵物美學,高雄市楠梓區樂群路131號,高雄市,楠梓區
寵物王朝有限公司,高雄市橋頭區成功南路148巷1號1樓,高雄市,橋頭區
富貴寵物澡堂,高雄市大寮區鳳林四路435之1號,高雄市,大寮區
唯樂寵物旅館,高雄市三民區民族一路782之8號,高雄市,三民區
寵物王朝有限公司岡山分公司,高雄市岡山區中山北路187號1樓,高雄市,岡山區
卡哇伊貓貓,高雄市左營區重清路256號,高雄市,左營區
卡特寵物用品有限公司,高雄市梓官區大舍南路65號,高雄市,梓官區
秀燕寵物生活館,高雄市左營區新庄仔路556號3樓,高雄市,左營區
寵物當家用品店,高雄市苓雅區四維一路105號,高雄市,苓雅區
貓茸茸寵物旅館,高雄市前鎮區高雄市前鎮區民權二路615號,高雄市,前鎮區
狗來樂寵物美容,高雄市仁武區八德南路100巷172號,高雄市,仁武區
麥可寵物世界店,高雄市左營區左營大路2-30號,高雄市,左營區
自遊自宅寵物住宿,高雄市左營區文學路655號,高雄市,左營區
謝謝妮寵物美坊,高雄市苓雅區高雄市苓雅區中興街53號,高雄市,苓雅區
洗洗睡寵物沙龍,高雄市楠梓區大學二十六街199號1樓,高雄市,楠梓區
貓裡居有限公司文三分公司,新北市林口區新北市林口區文化三路一段402巷2號2樓,新北市,林口區
貓之森寵物生活館,高雄市楠梓區慶昌街43巷1弄7號,高雄市,楠梓區
慢飛寵物美學,臺南市東區樹林街一段207號1樓,臺南市,東區
玩美小獸沙龍,臺北市中山區新生北路三段69號1樓,臺北市,中山區
堤柇有限公司,新北市板橋區龍翠里文聖街194號1. B1樓,新北市,板橋區
朵菈寵物生活館,新北市新莊區思源路166巷41號1樓,新北市,新莊區
福氣寵物店,新北市新莊區中平路334號1樓,新北市,新莊區
頭等艙寵物生活館,新北市新莊區後港一路76巷12弄2號1樓,新北市,新莊區
毛澡堂寵物沙龍,新北市新莊區公園路27號1樓,新北市,新莊區
維拉薇菈寵物精品店,新北市新莊區幸福東路115號1樓,新北市,新莊區
雅典犬舍,臺南市鹽水區橋南里16鄰南門路80巷20弄14號,臺南市,鹽水區
極光森林貓舍,新北市新莊區新崑路109號3樓,新北市,新莊區
小米毛澡堂,新北市新莊區中港路406巷2號1樓,新北市,新莊區
享日子寵物旅館,新北市新莊區昌盛街65巷2弄2號1樓,新北市,新莊區
好好寵物有限公司,新北市新莊區中央路108號1、2樓,新北市,新莊區
澎澎寵物旅館,新北市板橋區新生街29巷15弄2號1樓,新北市,板橋區
亞尼客寵物美容店,新北市板橋區大觀路3段142號1樓,新北市,板橋區
中圓寵物股份有限公司中壢分公司,桃園市中壢區金華里新生路286號,桃園市,中壢區
齊拉有限公司,新北市淡水區新北市新北市淡水區新民街31號,新北市,淡水區
露西寵物店,新北市三重區重新路4段136號1樓,新北市,三重區
享窩窩貓旅工作室,新北市板橋區長江路1段136巷10號1樓,新北市,板橋區
朵貓貓寵物工作室,新北市板橋區金門街372巷28號1樓,新北市,板橋區
狗趣兒寵物旅館,新北市林口區林口區文化三路1段617巷163號1樓,新北市,林口區
哈寶寵物美容館,新北市三重區重陽路1段60巷25號1樓,新北市,三重區
小不點寵物店,新北市板橋區萬安街53巷32號1樓,新北市,板橋區
享時光貓旅工作室,新北市板橋區新海路391巷2號1樓,新北市,板橋區
星貝貝寵物旅館,新北市板橋區莊敬路228號1樓,新北市,板橋區
東森寵物雲股份有限公司板橋雨農分公司,新北市板橋區新翠里雨農路54號1樓,新北市,板橋區
沐絲寵物美容坊,新北市蘆洲區蘆洲區永康街35號1樓,新北市,蘆洲區
喵毛屋有限公司,新北市板橋區民生路三段178號1樓,新北市,板橋區
寵愛汪喵企業社,新北市三重區忠孝路2段79號,新北市,三重區
貝果貝果,臺南市中西區南門路159號及159之1號,臺南市,中西區
毛孩慢步照護美容工作坊,臺南市東區林森路二段192巷13號,臺南市,東區
玖玖寵物美姿莊園坊,新北市林口區文化北路1段262號1樓,新北市,林口區
貓這裡手作工作室,臺南市東區崇德二十二街52號1樓,臺南市,東區
喬咪寵物美容,臺南市北區中華北路二段211號1樓,臺南市,北區
貓漾寵物生活館,臺南市安南區安南區同安路195巷40號,臺南市,安南區
一三三寵物沙龍旅館,新北市林口區四維路116號1樓,新北市,林口區
天麗寵物坊,新北市三芝區中山路1段88巷11號,新北市,三芝區
洛芙寵物精品店,新北市三重區吉祥街6號1樓,新北市,三重區
好喵寵物店,新北市林口區文化三路2段275號1樓,新北市,林口區
好運吧精緻寵物旅店,新北市淡水區大仁街33號1樓,新北市,淡水區
乖乖狗寵物店,新北市泰山區中華街18巷10號1樓,新北市,泰山區
欣愛寵物坊,新北市三重區中正南路81號1樓,新北市,三重區
毛孩渡假生活館,新北市林口區文化北路1段208號1樓,新北市,林口區
萌萌噠寵物美容,新北市泰山區新北市泰山區仁武街21號1樓,新北市,泰山區
中圓寵物股份有限公司林口分公司,新北市林口區忠孝路372號1樓,新北市,林口區
糖狗貓寵物沙龍,臺南市北區長榮路五段8之1號1樓,臺南市,北區
棲心寵物旅宿,臺南市安南區安南區長和路一段370號,臺南市,安南區
大大寵物旅館,新北市汐止區汐萬路一段19號1樓及地下室1樓,新北市,汐止區
護寵者聯萌寵物沙龍,臺南市南區三官路177號1樓,臺南市,南區
旺旺旺寵物生活館,臺南市北區西門路四段512、516號1樓,臺南市,北區
三福寵物用品店,新北市泰山區明志路一段488號1樓,新北市,泰山區
晟欣商行,臺南市東區崇善七街52號1樓,臺南市,東區
月光貓旅館,臺南市東區崇善路565號3樓,臺南市,東區
珍艾寵物館,臺南市東區東門路二段9號,臺南市,東區
絨毛小狗寵物美學,臺南市東區自由路一段177號1樓,臺南市,東區
心花朵朵開實業社,臺南市東區小東路364號1樓,臺南市,東區
寶貝園寵物生活館,臺南市東區長東街30號1樓,臺南市,東區
旺寶寵物生活館,臺南市東區東門路二段452號1-2樓,臺南市,東區
大魚寵物有限公司崇明分公司,臺南市東區崇明路511號,臺南市,東區
我的寵物精品生活時尚沙龍館,臺南市北區大興街46之1號1樓,臺南市,北區
好的寵物沙龍,新北市中和區自立路163號1樓,新北市,中和區
貓咪船長寵物旅館,臺南市安南區安中路一段130巷16之3號,臺南市,安南區
鑫嘉福寵物生活館,臺南市安南區溪東一街1號1樓,臺南市,安南區
貓卡卡貓咪文旅,臺南市安南區安和路五段356號,臺南市,安南區
寶貝洞寵物生活館,臺南市安南區長溪路一段242之1號,臺南市,安南區
田美寵物生活百貨,臺南市安平區文平路468號1-2樓,臺南市,安平區
凱弟寵物澡堂,臺南市安平區建平八街108巷40號,臺南市,安平區
波樂工坊,臺南市安平區永華十一街17巷33號1樓,臺南市,安平區
福貍工作室,臺南市安平區國平路5號1樓,臺南市,安平區
史溫托爾寵物店,臺南市安平區永華路二段660號1樓,臺南市,安平區
齊齊狗狗寄宿,臺南市南區大德街141巷18號2樓,臺南市,南區
桃樂斯寵物遊樂園,臺南市南區健康路二段251號,臺南市,南區
貓宅一生企業社,臺南市南區新興路160號,臺南市,南區
寵愛寵物生活館,臺南市永康區中華一路20號1樓,臺南市,永康區
捲尾巴寵物旅店,新北市永和區永平路300號1樓,新北市,永和區
悠洗寵物美容工作室,新北市汐止區明峰街53號1樓,新北市,汐止區
幸福種子寵物沙龍,臺南市永康區塩行里6鄰中正南路636號,臺南市,永康區
可愛谷寵物生活館,新北市中和區南山路273號1樓,新北市,中和區
萬達寵物事業股份有限公司東門分公司,臺南市東區東門路二段365巷26號,臺南市,東區
萬達寵物事業股份有限公司安平分公司,臺南市安平區華平路263號及265號,臺南市,安平區
喜恩精緻寵物美容館,臺南市永康區西橋里5鄰中華西街21巷8之1號1樓,臺南市,永康區
星期一貓旅舍,臺南市永康區大橋里5鄰大橋一街103巷218號,臺南市,永康區
甜蜜貓工作室,新北市永和區永和路2段228號3樓,新北市,永和區
環球購物中心股份有限公司中和分公司,新北市中和區中山路三段120號1樓,新北市,中和區
犬之湯屋寵物館,新北市中和區安樂路50號1樓,新北市,中和區
犬賓行,新北市汐止區鄉長路一段23號1樓,新北市,汐止區
比樂寵物精緻沙龍,臺南市歸仁區南興里1鄰民生北街140號,臺南市,歸仁區
萬達寵物事業股份有限公司台南歸仁分公司,臺南市歸仁區中山路二段222號,臺南市,歸仁區
雪麗犬舍,臺南市麻豆區新建里8鄰新生南路84號,臺南市,麻豆區
蔻蔻寵物沙龍,臺南市佳里區文新里6鄰文化路411號,臺南市,佳里區
呼嚕嚕貓旅寵物精品工作室,新北市三重區三重區重新路3段26號3樓,新北市,三重區
麻吉寵物沙龍,新北市三重區中正北路380巷2號1樓,新北市,三重區
沐寓寵物精緻旅館,新北市林口區新北市林口區民族路26號,新北市,林口區
佳和寵物用品公司,新北市淡水區民權路153號地下1樓,新北市,淡水區
饅頭音樂工作室,新北市林口區文化一路1段190巷8-1號,新北市,林口區
私房貓旅堂有限公司,新北市三重區五華街218號1樓,新北市,三重區
達詩股份有限公司,新北市三芝區後厝里土地公坑73-7、73-8號,新北市,三芝區
萬達寵物事業股份有限公司蘆洲門市部,新北市蘆洲區蘆洲區長榮路71號1樓,新北市,蘆洲區
寵沐企業社,新北市林口區民享路46號1樓及B1,新北市,林口區
福貓寵物旅館,新北市蘆洲區永安南路2段98號1樓,新北市,蘆洲區
酷毛寵物旅館,新北市林口區新北市林口區文化三路2段115巷68號1樓,新北市,林口區
鑫恩貓舍,新北市三重區新北市三重區三和路3段151巷39號,新北市,三重區
鋒毛孩寵物旅館,新北市三重區永安北路2段107號1樓,新北市,三重區
麻糬阿木工作室,新北市蘆洲區蘆洲區中山一路120巷19號1樓,新北市,蘆洲區
毛到家有限公司,新北市林口區民族路89號,新北市,林口區
晶鑽樂狗寵物生活館,新北市林口區文化北路1段60巷8號,新北市,林口區
侍寵派有限公司,新北市淡水區新市三路2段247號1樓,新北市,淡水區
秋味犬教育工作室,臺南市白河區河東里7鄰糞箕湖179號,臺南市,白河區
趴趴雞寵物生活館,新北市中和區成功路99之1號1樓,新北市,中和區
喜樂狗寵物美容生活館,新北市林口區文化三路一段617巷183號,新北市,林口區
艾莉亞寵物精品美容,新北市永和區得和路82號1樓,新北市,永和區
球球幼犬寵物店,新北市中和區中正路641號1樓,新北市,中和區
雪莉寵物生活館,臺南市東區崇德路785之8、9號,臺南市,東區
瑪恩寵物生活館,臺南市新營區民權里9鄰民權路106號,臺南市,新營區
啪啾寵物旅館,新北市永和區永貞路53號1樓,新北市,永和區
萬達寵物事業股份有限公司福德分公司,新北市三重區福德北路74號1樓,新北市,三重區
大魚寵物有限公司永康分公司,臺南市永康區安康里13鄰中華路707號,臺南市,永康區
有珈寵物美容坊,新北市蘆洲區集賢路224巷39之1號1樓,新北市,蘆洲區
奇巧手寵物用品店,臺南市安平區文平路215號,臺南市,安平區
錢櫃愛犬美容屋郡緯分店,臺南市中西區郡緯街39之1號,臺南市,中西區
錢櫃愛犬美容屋,臺南市安平區華平路698號1樓,臺南市,安平區
愛諾寵物生活館,臺南市中西區臨安路一段16號,臺南市,中西區
中美寵物生活館,臺南市東區府連路314號2樓,臺南市,東區
凱特莉寵物沙龍,桃園市蘆竹區南崁里南祥路21號,桃園市,蘆竹區
樂時頤國際企業有限公司,新北市汐止區明峰街7號1樓,新北市,汐止區
橘舍寵物沙龍旅館,新北市汐止區秀峰路144號1樓,新北市,汐止區
東森寵物雲股份有限公司麻豆興中分公司,臺南市麻豆區晉江里8鄰興中路164號,臺南市,麻豆區
阿棚喵貓屋,臺中市西屯區逢甲路20巷36號1樓,臺中市,西屯區
歐歐兔股份有限公司(犬),臺中市南屯區文心南二路398號1樓、地下1樓,臺中市,南屯區
福福貓有限公司,臺北市萬華區武昌街二段53號3樓,臺北市,萬華區
有間貓旅有限公司,臺北市松山區南京東路五段137之1號(2樓),臺北市,松山區
吹毛球痴洗澡吧,臺北市信義區松山路315之1號1樓,臺北市,信義區
米屋寵物美容,臺北市北投區北投路二段19號1樓,臺北市,北投區
玉月光村股份有限公司,臺北市信義區基隆路二段117號2樓,臺北市,信義區
愛玩犬寵美屋,臺北市北投區中正街69號1樓及2樓,臺北市,北投區
禾鑫寵物企業社,臺北市萬華區青年路172號1樓,臺北市,萬華區
茱式企業社,臺北市文山區三福街1號1樓,臺北市,文山區
羅娜寵兒有限公司,臺北市松山區民生東路五段206之2號1樓,臺北市,松山區
班森班比商行,臺北市南港區八德路四段917號1樓,臺北市,南港區
洗毛球寵物美容工作坊,臺北市文山區興隆路二段244巷32號1樓,臺北市,文山區
嘟波寵物自在生活坊,臺北市中山區民權東路一段38巷18弄1號5樓,臺北市,中山區
大爺股份有限公司寶吉分公司,臺北市內湖區民權東路六段123巷20弄5號1樓,臺北市,內湖區
喵喵屋有限公司,臺北市大安區建國南路二段19號1樓,臺北市,大安區
翻肚肚寵物美容,臺北市松山區民生東路五段202號之1一樓,臺北市,松山區
愛玩家犬貓寵物社,臺北市大安區光復南路686之1號1樓,臺北市,大安區
汪堡股份有限公司,臺北市中山區敬業一路46號1樓,臺北市,中山區
軒墨工作室,臺北市南港區向陽路162巷100號2樓,臺北市,南港區
蕙昌寵物企業社,臺北市中山區明水路549號1樓,臺北市,中山區
唯依寵物美學企業社,臺北市大安區基隆路二段162之4號1樓,臺北市,大安區
亞勵興業有限公司,臺北市內湖區成功路二段412號1樓,臺北市,內湖區
咕咕碁有限公司,臺北市內湖區東湖路7巷29號地下室,臺北市,內湖區
喜寶棧有限公司,臺北市中正區中華路二段307巷40號及42號1樓,臺北市,中正區
巧菲時尚寵物沙龍,臺北市士林區福國路63號1樓,臺北市,士林區
狗狗日常寵物旅館,臺北市文山區羅斯福路六段85號1樓及2樓,臺北市,文山區
永樂健康有限公司文山營業所,臺北市文山區興隆路一段261號1樓,臺北市,文山區
萬旺商行,臺北市松山區八德路四段512號1樓,臺北市,松山區
五個蹼生活館,臺北市中正區羅斯福路三段92號1樓,臺北市,中正區
豆恩凱寵物精品有限公司,臺北市文山區木新路二段1號1樓,臺北市,文山區
愛貓成癮有限公司,臺北市信義區莊敬路342號2樓,臺北市,信義區
寵愛之綴寵物美容工作室,臺北市大安區潮州街143號1樓,臺北市,大安區
貓室友工作室,臺北市士林區文林路512-1號1、2樓,臺北市,士林區
國寶寵物股份有限公司吉林分公司,臺北市中山區吉林路178號1、2、3樓,臺北市,中山區
菈菈寵物美容精品屋,臺北市文山區興隆路一段96號1樓,臺北市,文山區
我們和孩子們幸福的寵物沙龍,臺北市中山區長安東路二段220號1樓,臺北市,中山區
