name,address,city,district
俊妍手做商行,新北市中和區中安街178巷13弄8號1樓,新北市,中和區
阿毛寵物旅店,高雄市仁武區仁勇東巷230號,高雄市,仁武區
狗苑子寵物沙龍,臺中市大里區大里路128號1樓、2樓,臺中市,大里區
添柴日本柴犬專賣店,臺中市西屯區福雅路81號1樓,臺中市,西屯區
東森寵物雲股份有限公司小港桂陽分公司,高雄市小港區桂陽路115號,高雄市,小港區
萊恩生活有限公司,桃園市楊梅區永寧里環南路240號1樓,桃園市,楊梅區
洞伴樂齡寵物照護企業社,臺中市東區育英路37之21號1樓、2樓,臺中市,東區
狗狗將好狗居有限公司,新北市八里區八里區頂寮三街52巷2號,新北市,八里區
東森寵物雲股份有限公司土城中華分公司,新北市土城區中華路一段235號1樓(土城區中央路一段318巷20號1樓),新北市,土城區
萌寵天下寵物坊,臺南市白河區庄內里7鄰裕農路360號,臺南市,白河區
東森寵物雲股份有限公司仁武仁雄分公司,高雄市仁武區仁雄路33號,高雄市,仁武區
狗城堡寵物沙龍,新北市土城區中央路1段45巷7號1F,新北市,土城區
寵愛窩寵物美容館,新北市土城區學成路156號1樓,新北市,土城區
九八貿易有限公司,高雄市鼓山區文忠路86號,高雄市,鼓山區
愛迪兒寵物美容工作室,臺中市南區美村路二段293巷6號1樓,臺中市,南區
帕彼愛逗寵物精品時尚館,臺南市東區東門路二段240號,臺南市,東區
小毛頭寵物沙龍旅館,桃園市桃園區文中三路60號1樓,桃園市,桃園區
萬達寵物事業股份有限公司大有分公司,桃園市桃園區大有路581號1樓,桃園市,桃園區
洗洗睡寵物美容,桃園市蘆竹區興福街207之2號1樓,桃園市,蘆竹區
艾許寵物沙龍工作室,桃園市桃園區文中里正光一街88號1樓,桃園市,桃園區
庠陞寵物旅館,桃園市八德區永福西街32巷3號,桃園市,八德區
奇宸寵物店,桃園市桃園區明德里中埔六街177號1樓,桃園市,桃園區
沐沐卡夫寵物實業社,桃園市桃園區中成里慈文路635巷23號1樓,桃園市,桃園區
臭寶貝實業社,桃園市桃園區中平路177號1樓,桃園市,桃園區
龍慈寵物工作坊,桃園市中壢區後寮里龍慈路83號1樓,桃園市,中壢區
樓上遇見貓商行,臺北市松山區臺北市松山區南京東路三段256巷47號1樓,臺北市,松山區
東森寵物雲股份有限公司路竹中山分公司,高雄市路竹區中山路1205、1207、1209號,高雄市,路竹區
東森寵物雲股份有限公司岡山柳橋分公司,高雄市岡山區柳橋西路6、10號,高雄市,岡山區
東森寵物雲股份有限公司苓雅大順分公司,高雄市苓雅區大順三路218號1樓,高雄市,苓雅區
東森寵物雲股份有限公司楠梓藍昌分公司,高雄市楠梓區藍昌路421、423、425號 1樓,高雄市,楠梓區
巴蒂寵物旅館,新北市板橋區文化路1段136巷10號1樓,新北市,板橋區
寵愛有加股份有限公司,臺北市大安區安和路二段41號1樓,臺北市,大安區
大魚寵物有限公司,臺中市大里區國光路2段505號1樓,臺中市,大里區
千千寵物美容工作室,臺南市鹽水區岸內里10鄰和平路742號,臺南市,鹽水區
小魔女貓屋一番店,高雄市楠梓區大學十九街158號,高雄市,楠梓區
米默毛孩寓所,臺中市北屯區北屯路447之5號1樓,臺中市,北屯區
飽屋寵物美容,臺中市西屯區大隆路72號2樓,臺中市,西屯區
幸福毛球有限公司,臺中市北屯區南興一路28號1樓,臺中市,北屯區
大魚寵物有限公司文昌分公司,臺中市北屯區文心路四段806號1樓,臺中市,北屯區
貓阿舍寵物旅館,高雄市三民區嫩江街129巷4號1、2樓,高雄市,三民區
貓咪壹零壹寵物精品館,臺中市北區進化北路396之5號1樓,臺中市,北區
派滋威寵物沙龍,新北市板橋區貴興路67號1樓,新北市,板橋區
搖尾巴寵物美容館,高雄市鼓山區鼓山一路137號,高雄市,鼓山區
遇見寵物生活館,桃園市龜山區樂善里樂學一路122號,桃園市,龜山區
握握手寵物工坊,高雄市鳳山區南江街6號,高雄市,鳳山區
誼文寵物生活館,臺北市中山區中山北路三段55巷22號(代表號)等,臺北市,中山區
鳳甲寵物店,高雄市鳳山區南華一路133號,高雄市,鳳山區
新鑫犬舍,臺南市新營區新南里23鄰復興路672之1號,臺南市,新營區
毛言毛語寵物商行,臺中市南屯區春安二街36號,臺中市,南屯區
三中東區啦啦寶都股份有限公司(北館),臺中市東區進德路600號,臺中市,東區
食尚休閒餐飲有限公司,高雄市前金區中華三路6號,高雄市,前金區
皇良寵物生活館,臺北市大同區承德路二段6號1樓,臺北市,大同區
萌點寵物美容工坊,高雄市鳳山區文中街164號,高雄市,鳳山區
好窩犬舍,新北市永和區中正路512號1.2樓,新北市,永和區
貓裡居有限公司,新北市林口區四維路245巷18號1樓,新北市,林口區
萌下巴毛孩企業社,臺中市南區工學北路140號,臺中市,南區
優洗趣有限公司,桃園市中壢區領航南路三段350號,桃園市,中壢區
萬達寵物事業股份有限公司新莊佳瑪分公司,新北市新莊區幸福路716號1樓,新北市,新莊區
毛居寵物生活館,臺南市南區萬年五街248巷1號,臺南市,南區
浣熊寵物美容,高雄市鳳山區瑞順街125巷12號,高雄市,鳳山區
宜家宜犬寵物精品館,臺北市松山區八德路四段259號1樓,臺北市,松山區
綠棧道寵物旅館沙龍,高雄市楠梓區興楠路27號,高雄市,楠梓區
魚中魚樂活有限公司北屯分公司,臺中市北屯區文心路四段319號1樓,臺中市,北屯區
逗米寵物沙龍,臺中市豐原區圓環東路277號1樓,臺中市,豐原區
有你寵物美學沙龍,桃園市桃園區國豐三街203號1樓,桃園市,桃園區
犬太寵物生活館,新北市中和區景新街383巷74號1樓,新北市,中和區
貝貝窩寵物美學生活館,高雄市楠梓區大學二十一路237巷6號,高雄市,楠梓區
美力生寵物生活館,臺南市中西區大同路一段62號1樓,臺南市,中西區
包妮寵物店,高雄市鳳山區大明路185號1樓,高雄市,鳳山區
小尾巴客棧寵物旅館,臺南市安平區安平區慶平路689號2樓,臺南市,安平區
小品養殖行,臺南市仁德區中洲里6鄰中洲路667號1樓,臺南市,仁德區
萌寵生活館,新北市新莊區昌隆街58巷1弄1號1樓,新北市,新莊區
拾壹貓舍有限公司,高雄市鳳山區立德街228號,高雄市,鳳山區
樂兒國際有限公司,臺北市內湖區民權東路六段123巷34弄19號1及2樓,臺北市,內湖區
樂佩有限公司,臺北市中正區仁愛路二段68號1樓,臺北市,中正區
寵物私語店,臺南市安平區健康二街531號1樓,臺南市,安平區
搖滾獸工作室,新北市五股區新北市五股區芳洲一路86號,新北市,五股區
東森寵物雲股份有限公司前金自強一店分公司,高雄市前金區自強一路138號及140號1樓,高雄市,前金區
豪小子寵物精品有限公司,高雄市小港區中安路690之5號1樓,高雄市,小港區
莫莉家寵物美容旅館,新北市中和區景平路59之17號1樓,新北市,中和區
咘鈴寵物館,新北市板橋區大觀路三段142-1號1樓,新北市,板橋區
郁笙有限公司,臺北市南港區成福路82號,臺北市,南港區
朝代寵物有限公司,臺北市大安區基隆路二段232號1樓,臺北市,大安區
東森寵物雲股份有限公司大直北安分公司,臺北市中山區北安路554巷31號1樓及地下1樓,臺北市,中山區
萬達寵物事業股份有限公司五甲二店分公司,高雄市鳳山區五甲一路298號,高雄市,鳳山區
大御倉生物科技有限公司安和分公司,臺北市大安區安和路二段68號1樓及地下1樓,臺北市,大安區
卷毛有限公司,臺中市北屯區敦富五街37號,臺中市,北屯區
咪妮生活館有限公司,新北市新店區新店區中興路3段170號,新北市,新店區
萬達寵物事業股份有限公司前鎮瑞隆分公司,高雄市前鎮區瑞隆路480號,高雄市,前鎮區
逗卡寵物生活館,新北市林口區中山路565號1樓,新北市,林口區
王子與公主寵物美容,高雄市左營區西陵街94號,高雄市,左營區
犬弟寶寵物店,臺中市北屯區平興街2號1樓、2樓,臺中市,北屯區
喵可美學,臺中市西屯區大墩二十街103號1樓、2樓,臺中市,西屯區
花花萌寵屋,臺南市東區中華東路二段185巷16號,臺南市,東區
冠蓉寵物用品店,新北市新店區北新路2段187之1號1樓,新北市,新店區
好日子寵物犬屋,臺中市大里區中興路一段2巷263弄1號1樓,臺中市,大里區
慈愛生物科技股份有限公司,臺南市仁德區仁德里18鄰文華路三段448號2樓,臺南市,仁德區
慈愛生物科技股份有限公司仁德分公司,臺南市仁德區仁德里18鄰文華路三段448號1樓,臺南市,仁德區
花繆繆寵物生活館,新北市林口區文化三路二段115巷16號,新北市,林口區
三天二夜有限公司,臺北市中山區樂群三路73號2樓及75號2樓,臺北市,中山區
狗老爸寵物美容,桃園市中壢區興南里中美路一段42號1樓,桃園市,中壢區
魚中魚水族寵物有限公司,新北市中和區中正路211巷13弄7號1樓,新北市,中和區
真愛寵物美容,高雄市鳳山區自強一路214號,高雄市,鳳山區
好日子寵物美容,臺北市中山區北安路458巷39號1樓,臺北市,中山區
爪子精緻寵物沙龍店,臺北市中山區長春路3巷11弄3號,臺北市,中山區
萬達寵物事業股份有限公司新城分公司,新北市土城區金城路三段160號1樓,新北市,土城區
澡享受寵物沙龍,高雄市鳳山區鳳南路91號1樓,高雄市,鳳山區
噗荳寵物生活館,臺南市中西區南門路179之2號1樓,臺南市,中西區
牠的店,高雄市苓雅區三多二路261號,高雄市,苓雅區
嬌滴滴寵物園,高雄市前鎮區永豐路78-1號,高雄市,前鎮區
晧晧寵物精品,高雄市前鎮區一心二路42號,高雄市,前鎮區
想見妮寵物沙龍,臺南市永康區中山南路490巷2弄10號1樓,臺南市,永康區
醬棒貓旅工作室,臺中市西區自由路一段28-5號1樓,臺中市,西區
華納寵物有限公司,高雄市三民區建工路796號,高雄市,三民區
洗澡趣寵美生活小舖,新北市中和區民利街42號1樓,新北市,中和區
凱特精品貓旅館,新北市淡水區北新里北新路184巷154號1樓,新北市,淡水區
侑柔寵物美學沙龍,新北市土城區裕生路21巷6弄21號,新北市,土城區
一簍毛工作室,臺北市士林區天母西路3號5樓之20,臺北市,士林區
御毛屋寵物世界,臺中市太平區樹孝路429號1樓、2樓、3樓,臺中市,太平區
漁之鄉水族館,高雄市楠梓區右昌街715號,高雄市,楠梓區
佳晟寵物美容旅館,桃園市桃園區西門里民族路199之2號1及2樓,桃園市,桃園區
頂級寵物店,新北市板橋區南雅西路2段146號1樓,新北市,板橋區
芳如寵物美容,新北市新莊區民安西路139巷2號1樓,新北市,新莊區
萌駿寵物美容,高雄市小港區宏平路686號1樓,高雄市,小港區
留守犬有限公司,桃園市龍潭區上林里中豐路上林段358號1、2樓,桃園市,龍潭區
萌庭國際貿易有限公司,桃園市中壢區青埔里領航南路三段288號1樓,桃園市,中壢區
東森寵物雲股份有限公司林園東林東分公司,高雄市林園區東林東路28之1號1樓,高雄市,林園區
芥菜籽寵物輕旅店,臺南市永康區東橋里9鄰東橋十街32號3樓,臺南市,永康區
萬達寵物事業股份有限公司_天母分公司,臺北市士林區臺北市士林區天母西路12之1、12之2、12之3號,臺北市,士林區
毛意盎然有限公司,臺北市大同區民族西路268號1樓,臺北市,大同區
寵霸天寵物美容坊,臺北市信義區忠孝東路5段766號1樓,臺北市,信義區
卡蒂家的貓有限公司台北分公司,臺北市大同區臺北市大同區延平北路二段168號,臺北市,大同區
布露熊寵物美容,高雄市苓雅區河南路128號1樓,高雄市,苓雅區
年生樂商行,新北市板橋區合宜路217號1樓,新北市,板橋區
愛貓仕實業社,新北市土城區廣明街90巷25號1樓,新北市,土城區
逸洤有限公司,臺北市士林區天母東路13號,臺北市,士林區
逸升有限公司,臺北市中山區建國北路二段129號1樓及地下1樓,臺北市,中山區
金福寵物美容屋,高雄市林園區仁愛路40號,高雄市,林園區
貓云殿工作坊,臺北市信義區松仁路285號1樓,臺北市,信義區
萬達寵物事業股份有限公司淡水中正分公司,新北市淡水區中正東路77號1樓,新北市,淡水區
豆宅狗旅館,臺北市文山區木柵路一段328號1樓,臺北市,文山區
平福寵物美容屋,高雄市三民區正興路104號,高雄市,三民區
貓狗同萌有限公司,臺北市中山區新生北路一段138號地下1樓,臺北市,中山區
萬達寵物事業股份有限公司新維分公司,新北市新莊區富國路112號1樓,新北市,新莊區
雅雅愛犬專業用品店,臺北市內湖區臺北市內湖區環山路一段63號1樓,臺北市,內湖區
虎寶貝寵物沙龍,高雄市苓雅區建民路69號1樓,高雄市,苓雅區
放飼寵物工作坊,臺中市沙鹿區賢仁街27號1樓、3樓,臺中市,沙鹿區
玄瑞有限公司,臺中市霧峰區中正路422號1樓,臺中市,霧峰區
安安貓咪寵物工作室,臺中市大里區德芳南一街226號,臺中市,大里區
東森寵物雲股份有限公司歸仁中山分公司,臺南市歸仁區南保里25鄰中山路三段97號1樓,臺南市,歸仁區
豬鼻子寵物旅館,桃園市蘆竹區中興里豪登一街166之1號,桃園市,蘆竹區
維嫺企業社,高雄市鳳山區青年路二段135號1樓,高雄市,鳳山區
狗窩商行,臺北市文山區興隆路四段86號1樓及地下1樓,臺北市,文山區
美樂蒂寵物靚坊,臺南市東區東寧路316號,臺南市,東區
壞壞狗寵物美容住宿,臺南市北區成功路382號之1,臺南市,北區
毛多多生活館,新北市鶯歌區鳳七路290、292號1樓、夾層,新北市,鶯歌區
東洋犬舍,高雄市梓官區忠孝路237-1號,高雄市,梓官區
毛毛兄弟會寵物美容,桃園市平鎮區中庸路35號1樓,桃園市,平鎮區
捲球寵物沙龍館,桃園市中壢區榮安十三街270號1樓,桃園市,中壢區
禹翔寵物美容,桃園市楊梅區秀才路77號1樓,桃園市,楊梅區
慶昇昌有限公司,桃園市平鎮區湧豐里中豐路山頂段80號,桃園市,平鎮區
萬達寵物事業股份有限公司楠梓楠新分公司,高雄市楠梓區楠梓新路233號,高雄市,楠梓區
萌小菲貓舍,臺中市太平區新福路122號1樓、2樓,臺中市,太平區
萬達寵物事業股份有限公司林口仁愛分公司,新北市林口區仁愛路2段506號,新北市,林口區
辛普森寵物概念館,臺北市北投區義理街64號1樓,臺北市,北投區
愛狗狗旅館,臺南市北區西門路四段282號1樓,臺南市,北區
有毛有限公司,臺北市松山區八德路四段649號2樓,臺北市,松山區
極尚貓舍,臺中市大里區向學一路131號3樓,臺中市,大里區
伏特窩寵物旅館,臺中市大雅區中山北路450巷8號,臺中市,大雅區
小步毛舍股份有限公司,臺中市北屯區環太東路503號1樓,臺中市,北屯區
桃樂貝寵物沙龍,臺中市東區台中路131號1樓,臺中市,東區
東森寵物雲股份有限公司桃園蘆竹分公司,桃園市蘆竹區福昌里南昌路266號、南順八街63號,桃園市,蘆竹區
相信專業寵物美容,桃園市八德區福興里長興二路83號,桃園市,八德區
天郝有限公司,桃園市桃園區大興里大興路5號,桃園市,桃園區
維緹寵物有限公司富國分店,高雄市左營區富國路8號,高雄市,左營區
黛比愛犬專業剪藝,臺南市中西區金華路四段103號,臺南市,中西區
萬達寵物事業股份有限公司_台北忠五分公司,臺北市信義區忠孝東路五段201號、203號1樓,臺北市,信義區
黑鼻子寵物服務有限公司,臺北市北投區自強街164號1樓,臺北市,北投區
宏亞寵物沙龍,新北市新店區新店區中央路5號1樓,新北市,新店區
吉弄寵物沙龍,高雄市楠梓區大學南路993號1樓,高雄市,楠梓區
環亞寵物用品有限公司橋頭營業所,高雄市橋頭區典昌路36號,高雄市,橋頭區
維緹寵物有限公司,高雄市新興區五福二路128號,高雄市,新興區
米粒貓舍,臺中市霧峰區中正路230巷25號,臺中市,霧峰區
寶羅寵物精品店,高雄市苓雅區三多二路290號1樓,高雄市,苓雅區
奧莉寵物美容工作室,高雄市林園區忠義三街39號1至2樓,高雄市,林園區
四葉草貓舍,新北市新店區長春路43巷58號1樓,新北市,新店區
艾狗美寵物專業美容,高雄市小港區中安路600號1樓,高雄市,小港區
華寵寵物生活館,桃園市桃園區信光里大連四路16號1樓,桃園市,桃園區
繆思貓咪旅館,臺中市大里區德芳路一段12號1樓、2樓,臺中市,大里區
必勝犬社,臺中市烏日區振興街33-7號,臺中市,烏日區
飛馬寵物用品行,高雄市三民區九如一路980號,高雄市,三民區
喵喵屋,桃園市蘆竹區坑口里海山路一段79號,桃園市,蘆竹區
瑞奇馬汀寵物店,新北市新店區北新路1段123號1樓,新北市,新店區
微笑寵物生活館,高雄市鳳山區誠德街66號,高雄市,鳳山區
家合寵物美容工作坊,高雄市仁武區澄合街272號,高雄市,仁武區
貓膩會館,臺北市大安區光復南路702號1樓,臺北市,大安區
伴伴寵物美容,臺北市北投區中正街68號1樓,臺北市,北投區
乖狗狗寵物坊,高雄市鳳山區中山西路173號,高雄市,鳳山區
中圓寵物股份有限公司,桃園市桃園區同安里中正路836號,桃園市,桃園區
漢克哈士奇寵物名店,桃園市楊梅區桃園市楊梅區東流里中山南路688號1、2樓,桃園市,楊梅區
星特寵物生活館,臺中市西屯區朝馬路26號1樓、2樓,臺中市,西屯區
貓掌印別館,臺中市西區自由路一段40之6號1樓,臺中市,西區
魚中魚樂活有限公司樹林分公司,新北市樹林區中正路103號1樓,新北市,樹林區
派特屋有限公司,新北市新店區如意街1巷8號1樓,新北市,新店區
聽貓說貓咪旅館,新北市土城區中正路67巷33號1樓,新北市,土城區
卡澄寵物美容,新北市土城區福仁街14號,新北市,土城區
安佐樂寵物館,臺南市東區小東路248之2號1樓,臺南市,東區
熊汪寵物美容,高雄市苓雅區正義路150號,高雄市,苓雅區
哈米寵物生活舘,新北市土城區學府路一段98巷17號1樓,新北市,土城區
萌寵企業社,新北市土城區永豐路13巷26號1樓,新北市,土城區
格萊雅寵物美學館,新北市土城區廣興街27號1樓,新北市,土城區
筑夢寵物美容,新北市土城區明峯街6巷35號1樓,新北市,土城區
布逗熊寵物店,新北市新店區新店區三民路32號,新北市,新店區
貝帝寵物精品館,新北市深坑區北深路2段55巷12弄3號1樓,新北市,深坑區
得意寵物用品店,新北市新店區北新路二段187號1樓,新北市,新店區
喵的地球總部喵天地寵物沙龍,新北市新店區寶慶街81號1樓,新北市,新店區
親穎水族設計館,新北市鶯歌區鶯桃路496號1樓,新北市,鶯歌區
幸運草貓舍,新北市鶯歌區鶯桃路594號1樓,新北市,鶯歌區
瀟灑寵物美容,新北市永和區仁愛路287號1樓,新北市,永和區
香永寵物美容坊,新北市三峽區大德路8號1樓,新北市,三峽區
阿默寵物美學,新北市三峽區三峽區國學街1號1樓,新北市,三峽區
雪之犬寵物美容店,新北市樹林區中華路153號1樓,新北市,樹林區
瑪莎寵物美學,新北市樹林區佳園路3段486號1樓,新北市,樹林區
愛神寵物美容店,新北市土城區清水路88號,新北市,土城區
雅典娜寵物沙龍,新北市永和區國光路37號1樓,新北市,永和區
晟藍有限公司,新北市土城區青和街333號,新北市,土城區
晟藍有限公司青和分公司,新北市土城區土城區青和街329號1樓,新北市,土城區
萬達寵物事業股份有限公司台中西屯分公司,臺中市西屯區臺中市西屯區大隆路140號,臺中市,西屯區
呂館寵物生活館,臺中市大里區中興路二段249巷1號,臺中市,大里區
犬家寵物美容旅館,臺中市大里區西榮路260巷35號,臺中市,大里區
頑皮狗寵物店,高雄市大寮區鳳屏一路195、197號,高雄市,大寮區
田蓉貿易有限公司,高雄市鳳山區建國路二段118、120號,高雄市,鳳山區
太妃工坊,臺南市東區東安路82號1樓,臺南市,東區
貓家貓旅館,高雄市左營區重上街145號,高雄市,左營區
免睏寵物樂園,桃園市中壢區青埔里高鐵北路二段97號1、2、3樓,桃園市,中壢區
優蜜兒專業寵物美容,臺中市北屯區文心路四段960號,臺中市,北屯區
旺憂有限公司忠明分公司,臺中市北區忠明路331號、333號、335號,臺中市,北區
噗滿貓舍,臺中市西屯區中清路二段1250巷5號1樓,臺中市,西屯區
草妮瑪寵物美容,新北市板橋區溪崑二街6號1樓,新北市,板橋區
吉的寶澡堂,新北市板橋區溪北路148號1樓,新北市,板橋區
馨動寵物坊,新北市板橋區文化路1段46巷8號1樓,新北市,板橋區
蜜蜜基地寵物美容商行,新北市板橋區中正路250巷8號,新北市,板橋區
橘子毛實業社,新北市板橋區松柏街1巷13號1樓,新北市,板橋區
貓後苑有限公司,新北市板橋區四川路1段59號2樓,新北市,板橋區
貓肥家貓咪旅館,新北市板橋區文化路2段45號1樓,新北市,板橋區
普羅寵物生活館,新北市板橋區四川路一段174號1樓,新北市,板橋區
萬達寵物事業股份有限公司台南新營分公司,臺南市新營區新營區三民路152之17號,臺南市,新營區
泰迪幼犬寵物犬舍,臺南市永康區龍埔里7鄰自強路646號1-2樓,臺南市,永康區
水喬寵物美容造型,新北市板橋區永豐街51號1樓,新北市,板橋區
酷妮家寵物美容SPA館,新北市新莊區中興街26號1樓,新北市,新莊區
芋妮貓寵物生活館,臺北市南港區重陽路125巷16號1樓,臺北市,南港區
新頑皮族寵物用品社,高雄市前鎮區一心一路36號,高雄市,前鎮區
超級愛狗寵物沙龍,高雄市左營區民族一路1018號,高雄市,左營區
順竩有限公司,臺北市北投區復興四路16之1號1樓,臺北市,北投區
宅貓商行,臺北市中山區民生東路二段3號1樓,臺北市,中山區
寵沐殿企業社,臺南市安平區健康路三段315號1樓,臺南市,安平區
約伯行旅,新北市板橋區民族路129巷12弄15號,新北市,板橋區
喜得貓社,臺北市大安區基隆路二段102號1樓,臺北市,大安區
白喵宿舍,臺中市豐原區豐原大道三段286巷58弄88號,臺中市,豐原區
森蕊寵物有限公司,臺南市永康區東橋里11鄰東橋一路300號,臺南市,永康區
高冷貓旅館貓住宿,臺南市北區北成路72號1樓,臺南市,北區
甜美果寵物沙龍企業社,新北市淡水區新市三路二段289號,新北市,淡水區
噯銤寵物美容用品店,桃園市蘆竹區福興里奉化路266號1樓,桃園市,蘆竹區
懶洋洋寵物沙龍,高雄市楠梓區大學三十一街173號1樓,高雄市,楠梓區
佳佳寵物店,臺中市北屯區梅川西路四段285號,臺中市,北屯區
小毛廬企業社,臺南市北區開元路148巷43弄19號1樓,臺南市,北區
澎澎寵物旅宿,臺中市清水區港都一路98號2樓,臺中市,清水區
植沐寵物沙龍,臺南市新化區豐榮里2鄰正新路102號1樓,臺南市,新化區
小可愛寵物店,新北市板橋區中正路360巷15號1樓,新北市,板橋區
有間寵物店 ,新北市板橋區中山路1段206巷97號1樓,新北市,板橋區
宜加寵物生活館,新北市新莊區中正路380號1樓,新北市,新莊區
連夢露寵物美容室,臺北市大同區承德路一段83號1樓,臺北市,大同區
日巷工作室,臺北市南港區南港路一段287巷2弄6號1樓,臺北市,南港區
安若科技有限公司,桃園市平鎮區復旦里民族路二段193巷57號,桃園市,平鎮區
美美狗寵物美容館,臺中市西屯區至善路38巷1號,臺中市,西屯區
汪了個喵寵物美容,高雄市楠梓區卓越路159號,高雄市,楠梓區
熊寶貝寵物精剪,高雄市三民區九如一路307號1樓,高雄市,三民區
迷漾狗寵物,高雄市大寮區鳳林三路696號,高雄市,大寮區
澎澎時光寵物美容,高雄市苓雅區光華一路311號,高雄市,苓雅區
永淳企業社,高雄市三民區覺民路6號,高雄市,三民區
萬達寵物事業股份有限公司_鼎山分公司,高雄市三民區鼎山街255號,高雄市,三民區
皮老闆寵物旅館,高雄市三民區哈爾濱街29號2樓,高雄市,三民區
僑美寵物美容量販,高雄市路竹區中山路786號,高雄市,路竹區
親禾寵物高鐵會館,高雄市左營區大中二路262號,高雄市,左營區
小守居企業社,臺中市太平區立文街217號,臺中市,太平區
萬達寵物事業股份有限公司國光分公司,新北市板橋區國光路61號1樓,新北市,板橋區
東森寵物雲股份有限公司左營左大分公司,高雄市左營區左營大路161、163號,高雄市,左營區
窩牛寵物旅館,高雄市鼓山區瑞豐街134號,高雄市,鼓山區
汪芙企業社,高雄市三民區明賢街42號,高雄市,三民區
相浴寵物沙龍,高雄市楠梓區惠豐街190號,高雄市,楠梓區
旺太郎寵物沙龍,高雄市苓雅區正義路237號,高雄市,苓雅區
豬窩寵物美容,新北市中和區民德路60號1樓,新北市,中和區
滴塔寵物美容館,新北市中和區板南路170號1樓,新北市,中和區
