name,address,city,district
貓悅良犬寵物精品店,臺北市大安區基隆路二段110號1樓及2樓,臺北市,大安區
東森寵物雲股份有限公司左營左大分公司,高雄市左營區左營大路161、163號,高雄市,左營區
東森寵物雲股份有限公司楠梓興楠分公司,高雄市楠梓區興楠路60號,高雄市,楠梓區
樂沛寵物,高雄市楠梓區土庫一路10號,高雄市,楠梓區
艾妮寵物沙龍,臺北市萬華區德昌街121號1樓,臺北市,萬華區
晨曦寵物有限公司,桃園市桃園區龍安里龍安街109號,桃園市,桃園區
沐然之森工作坊,臺中市北區錦南街19之18號1樓,臺中市,北區
嘉鈞股份有限公司,臺中市西屯區福科路370號1樓、2樓、3樓、4樓及 372號1樓、2樓、3樓、4樓,臺中市,西屯區
小短腿寵物美容院,新北市八里區八里區頂罟一路56號1樓,新北市,八里區
就愛毛寶貝寵物美容,臺中市大里區德芳路一段144號1樓、2樓,臺中市,大里區
逗逗先生寵物沙龍,新北市永和區得和路178號1樓,新北市,永和區
緹米貓旅館,新北市永和區福和路167號2樓,新北市,永和區
寶貝窩寵物生活館,桃園市蘆竹區錦興里中正路341號1樓,桃園市,蘆竹區
瑞發財貓旅館,臺南市南區金華路一段468號1-2樓,臺南市,南區
玖逗瑪得寵物沙龍,新北市中和區景平路746號1樓,新北市,中和區
吾悠喵旅生活館,新北市中和區中正路210號1樓,新北市,中和區
國寶寵物股份有限公司,臺北市士林區中山北路七段20號、20之1號及22號1樓,臺北市,士林區
毛嶼商行,新北市新店區中興路2段221號,新北市,新店區
帕比寵物,臺南市新營區大宏里8鄰文昌街42之1號,臺南市,新營區
寵萌殿堂 ,新北市板橋區民生路2段234巷2弄13號1樓,新北市,板橋區
樂牧寵物旅館,新北市新莊區建興街20號1樓,新北市,新莊區
樂恆寵物有限公司,新北市永和區中和路421巷3弄1號1樓、2樓,新北市,永和區
糖果屋貓咪旅館,新北市板橋區大觀路2段7巷24號,新北市,板橋區
給貓金幣坊,臺南市中西區五妃街72號1樓及地下層,臺南市,中西區
凱斯實業社,新北市新莊區新興街26號1樓,新北市,新莊區
托托寵物工坊,桃園市八德區桃園市八德區大福里大福街53巷8號,桃園市,八德區
帕比樂寵物企業社,臺中市北屯區柳陽西街118號,臺中市,北屯區
米汪寵毛店,臺中市霧峰區五福西路258號,臺中市,霧峰區
優質幼犬專賣,高雄市鳳山區光復路二段277號1、2樓,高雄市,鳳山區
乾乾咬一口寵物館,高雄市三民區興昌街83巷13號1、2樓,高雄市,三民區
小喬米寵物美容,新北市板橋區長江路2段57號1樓,新北市,板橋區
狗勾寓所商行,新北市板橋區中山里合宜路131號1樓,新北市,板橋區
毛起來住寵物旅館,新北市板橋區板橋區富山街89號1樓,新北市,板橋區
五心興業有限公司,臺中市豐原區圓環東路839號1、2、3樓,臺中市,豐原區
賀嘎宅貓咪旅館,臺南市北區開元路477號1樓及地下層,臺南市,北區
狗狗樂寵物造型沙龍,桃園市桃園區大豐里樹林四街84號1樓,桃園市,桃園區
環球購物中心股份有限公司桃園分公司,桃園市中壢區桃園市中壢區芝芭里高鐵南路二段352號1樓,桃園市,中壢區
享沐企業社,新北市板橋區光武街40號1樓,新北市,板橋區
喵狗幫幼犬寵物店,臺中市大里區臺中市大里區中興路一段320之1號,臺中市,大里區
貝多芬寵物造型生活館,臺北市中山區長安東路一段39-2號1樓,臺北市,中山區
汪堡股份有限公司內湖分店,臺北市內湖區南京東路六段451巷21號及23號1樓,臺北市,內湖區
樂沐寵物美容館,臺中市南區工學路6-2號1樓,臺中市,南區
羅弟家寵物生活館,臺中市西區民興街133號1樓、2樓,臺中市,西區
羊咩咩寵物生活館,高雄市鳳山區文藝街170號,高雄市,鳳山區
法蘭西斯卡寵物美容,高雄市苓雅區福建街258號,高雄市,苓雅區
東興貝貝寵物有限公司,臺中市南屯區東興路三段253號1樓、2樓,臺中市,南屯區
忻成寵物有限公司,臺中市北區臺中市北區忠太東路117號、117之1號,臺中市,北區
汪家寵物旅館,桃園市桃園區華南里4鄰中華路148號1樓,桃園市,桃園區
唯一寵物,桃園市桃園區桃園市桃園區建國里桃鶯路58號,桃園市,桃園區
洗澡吧寵物澡堂,臺北市內湖區成功路四段328號1樓,臺北市,內湖區
毛棧股份有限公司,臺中市西區美村路一段245號1樓、2樓、3樓,臺中市,西區
咕嚕咕嚕雙腸寵美精品旅館,臺中市北區進化北路396之3號1樓、2樓,臺中市,北區
天星實業社,高雄市新興區竹圍路6號,高雄市,新興區
台灣邦尼寵物用品有限公司,臺中市太平區樹德路256號,臺中市,太平區
明星寵物精品館,新北市土城區金城路三段73巷4弄2號1樓,新北市,土城區
宬銘屋寵物生活館(毛毛窩寵物精品旅館),臺北市文山區景隆街48號及48-1號1樓,臺北市,文山區
苙堡寵物生活館,新北市三重區新北市三重區中寮街99號,新北市,三重區
立裘寵物美容,臺中市大里區國光路二段353號1樓,臺中市,大里區
萬達寵物事業股份有限公司汐康分公司,新北市汐止區康寧街519號1樓,新北市,汐止區
吃手手寵物事業有限公司,臺北市中正區濟南路二段35號之1一樓,臺北市,中正區
毛寓所寵物美容旅店,新北市板橋區溪北路30號1樓,新北市,板橋區
喜多寵物美容住宿館,新北市板橋區中山路1段283巷2弄25號1樓,新北市,板橋區
喵了個汪寵物生活館,臺北市北投區中和街275號1樓及2樓,臺北市,北投區
萬達寵物事業股份有限公司台北興隆分公司,臺北市文山區興隆路二段343號及345號1樓,臺北市,文山區
萬達寵物事業股份有限公司台北安和分公司,臺北市大安區安和路二段225號1樓,臺北市,大安區
丹佛企業行,高雄市鳳山區中山東路64之3號1樓,高雄市,鳳山區
萬達寵物事業股份有限公司林口中山分公司,新北市林口區中山路248之1號1樓,新北市,林口區
慶福水族有限公司,臺中市南屯區文心路一段372號1樓、2樓,臺中市,南屯區
佳士德國際貿易股份有限公司,桃園市桃園區文中里延壽街162號2樓,桃園市,桃園區
來電狗寵物水族館,新北市三重區新北市三重區力行路2段99號1樓,新北市,三重區
萬達寵物事業股份有限公司新陽分公司,新北市三重區重陽路3段152號1樓,新北市,三重區
富藝寵物沙龍概念館,高雄市三民區覺民路50號,高雄市,三民區
星都實業股份有限公司,高雄市鼓山區青海路396號(右側),高雄市,鼓山區
萬達寵物事業股份有限公司台南善化分公司,臺南市善化區光文里19鄰忠孝路1之1號,臺南市,善化區
佳美國際有限公司,臺中市南屯區大英街173號1樓、2樓,臺中市,南屯區
貓僕舍寵物商行,臺北市大同區重慶北路三段73號1樓,臺北市,大同區
毛孩森林寵物生活館,臺中市西屯區上石路65號1樓,臺中市,西屯區
心寵有限公司,新北市新莊區福德一街72號及76號1樓,新北市,新莊區
萬達寵物事業股份有限公司新海分公司,新北市板橋區英士路74號1樓,新北市,板橋區
跑跑跳寵物旅館,高雄市楠梓區東昌街23號,高雄市,楠梓區
悠遊寵物有限公司,桃園市觀音區崙坪里福坪路195巷100號1、2、3樓,桃園市,觀音區
喵汪汪澡堂,新北市樹林區中山路3段181號1樓,新北市,樹林區
小蘋果寵物犬舍,臺南市新化區協興里8鄰太平街130及132號1樓,臺南市,新化區
靚靚寵物美容生活館,新北市中和區景平路578號1樓,新北市,中和區
苙田寵物精品生活舘,新北市板橋區南雅南路2段20號1樓,新北市,板橋區
陽陽寵物店,桃園市蘆竹區五福里五福六路81號,桃園市,蘆竹區
荷娜寵物美容,臺北市士林區天母東路50巷20-2號1樓,臺北市,士林區
阿法小姐金典寵物館,新北市板橋區文化路2段410巷32號1樓,新北市,板橋區
庚旺有限公司,臺北市中山區德惠街4號1樓,臺北市,中山區
洗寶貝寵物美容,臺北市大同區重慶北路三段75號1樓,臺北市,大同區
優仕寵物生活館,臺北市大安區羅斯福路三段139號1樓及2樓,臺北市,大安區
東森寵物雲股份有限公司臺中北屯分公司,臺中市北屯區北屯路218號、220號,臺中市,北屯區
東森寵物雲股份有限公司臺中大里分公司,臺中市大里區國光路二段441號,臺中市,大里區
東森寵物雲股份有限公司豐原圓環東分公司,臺中市豐原區圓環東路257號1樓,臺中市,豐原區
東森寵物雲股份有限公司西屯青海分公司,臺中市西屯區青海路二段225號,臺中市,西屯區
東森寵物雲股份有限公司臺中沙鹿分公司,臺中市沙鹿區臺灣大道七段279號、281號,臺中市,沙鹿區
東森寵物雲股份有限公司台中軍功分公司,臺中市北屯區軍功路一段603號,臺中市,北屯區
永浤寵物生活館,高雄市新興區七賢一路508號,高雄市,新興區
貓羅紀有限公司,新北市三重區新北市三重區重陽路2段61號,新北市,三重區
喵屋日和商行,新北市板橋區合宜路13號1樓,新北市,板橋區
家溱喵宅社,新北市林口區文化ㄧ路1段117號1樓,新北市,林口區
東森寵物雲股份有限公司三民建工分公司,高雄市三民區建工路351號1、2樓,高雄市,三民區
毛毛愛狗樂寵物店,高雄市新興區林森一路187號2樓,高雄市,新興區
萌萌狗企業社,新北市新莊區萬安街3號1樓,新北市,新莊區
貓悅居貓旅館,新北市三重區新北市三重區重陽路3段5巷28-2號,新北市,三重區
爵靈企業有限公司(超可愛名犬企業社),臺北市大安區基隆路二段134之1號1樓,臺北市,大安區
尾尾道來寵物股份有限公司,臺中市北屯區崇德十路一段88號,臺中市,北屯區
大魚寵物有限公司十甲分公司,臺中市東區十甲東路616號,臺中市,東區
魚中魚樂活有限公司,臺中市南屯區文心路一段378號27樓之6,臺中市,南屯區
愛逗格寵物沙龍,臺南市善化區坐駕里11鄰建國路19號之11(1樓),臺南市,善化區
咩咩旺寵物美容館,桃園市平鎮區北貴里金陵路三段103之2號1樓,桃園市,平鎮區
犬犬滿福寶犬屋,臺中市清水區海濱路266號,臺中市,清水區
萬達寵物事業股份有限公司台中大里分公司,臺中市大里區國光路二段409號1樓,臺中市,大里區
可麗愛犬美容屋,臺中市北區崇德路一段516號1樓,臺中市,北區
青沐犬舍,臺中市西區四維街20號1樓,臺中市,西區
金犬家莊寵物精品店,新北市八里區龍米路2段12號1樓,新北市,八里區
恩犬商行,新北市新店區環河路14-1號1樓,新北市,新店區
逗貓坊,臺北市信義區永吉路380號1及2樓,臺北市,信義區
承楓企業社,臺北市士林區士東路37號1樓,臺北市,士林區
寵翻天商行,新北市中和區捷運路173號1樓,新北市,中和區
汪福寵物澡堂,高雄市鳳山區瑞竹路75號1樓,高雄市,鳳山區
烤布奇諾有限公司,臺北市中正區和平西路二段64號1樓,臺北市,中正區
晨曦毛旅館,臺中市南區臺中市南區國光路65號,臺中市,南區
茉莉寵物店,桃園市桃園區南豐三街24號1樓,桃園市,桃園區
萬達寵物事業股份有限公司一心分公司,臺中市南屯區公益路二段169號3樓,臺中市,南屯區
貓卜勒有限公司,臺中市西屯區朝馬一街27號1樓,臺中市,西屯區
吉貓寓所,臺北市大安區和平東路二段297號3樓,臺北市,大安區
布朗泰菈寵物沙龍店,臺中市西區美村路一段711號1樓、2樓,臺中市,西區
伊嘉寶貝寵物美容坊,桃園市桃園區寶慶里同德五街268號,桃園市,桃園區
胖狗屋寵物坊,新北市永和區永貞路85號及85-1號1樓,新北市,永和區
愛莉塔寵物館,新北市板橋區南雅西路2段82號1樓,新北市,板橋區
快樂熊寵物美容坊,新北市板橋區民權路67號1樓,新北市,板橋區
甜甜寶貝樂園寵物貿易有限公司,新北市板橋區介壽街100號1樓,新北市,板橋區
狗窩好日子有限公司,臺北市松山區民生東路五段137巷2-5號1樓,臺北市,松山區
比佛利寵物水族時尚館,新北市蘆洲區重陽街99及101號1樓,新北市,蘆洲區
喜樂狗日子有限公司,臺中市西屯區安和路59之2號1樓、2樓、地下1樓,臺中市,西屯區
萬達寵物事業股份有限公司漢口分公司,臺中市北區漢口路四段297號,臺中市,北區
國寶寵物股份有限公司松江分公司,臺北市中山區松江路382號1樓,臺北市,中山區
快樂狗寵物生活館,臺南市永康區安康里17鄰中華路677號,臺南市,永康區
喵團錦簇貓舍,臺北市松山區八德路四段604-1號1樓,臺北市,松山區
嘟嘟好遇見你寵物生活館,新北市新莊區民安西路78巷4號1樓,新北市,新莊區
貝貝寵物有限公司,臺中市南屯區大墩十一街283號,臺中市,南屯區
寵寵慾動寵物美容沙龍館,新北市新莊區中誠街13號1樓,新北市,新莊區
萬達寵物事業股份有限公司板慶分公司,新北市板橋區重慶路110號1樓,新北市,板橋區
雀而喜貓舍有限公司,新北市新莊區新莊區銘德街25、27號1樓,新北市,新莊區
萬達寵物事業股份有限公司永康分公司,臺南市永康區五王里16鄰中華路430號,臺南市,永康區
哈克狗與湯姆貓寵物生活館,高雄市苓雅區四維三路174-5號,高雄市,苓雅區
捲一圈貓旅館,高雄市三民區十全一路2號,高雄市,三民區
超貼心寵物美容旅館,桃園市中壢區興南里延平路352號2樓,桃園市,中壢區
貓頭目貓咪旅館,高雄市左營區重吉路18號,高雄市,左營區
寵樂寵物美容,新北市蘆洲區新北市蘆洲區永樂街75號,新北市,蘆洲區
貓家日子股份有限公司,新北市三重區新北市三重區三民街68號,新北市,三重區
萬達寵物事業股份有限公司_小港漢民分公司,高雄市小港區漢民路299號1樓及2樓,高雄市,小港區
肥娜寵物快剃店,高雄市小港區孔鳳路438之8號1樓,高雄市,小港區
哇卡寵物,臺中市大里區國光路二段626號1樓,臺中市,大里區
毛巧可寵物旅宿,臺中市南區南平路39之5號1樓,臺中市,南區
祺福愛犬美容屋,高雄市左營區裕誠路173號1樓,高雄市,左營區
韻羽股份有限公司,臺北市大安區復興南路一段76號10樓之3,臺北市,大安區
轟轟的家寵物美容,高雄市苓雅區中正一路436號1樓,高雄市,苓雅區
啾咪寵物美容,臺南市東區前鋒路50號,臺南市,東區
米雅寵物工作室,臺南市中西區友愛街359號,臺南市,中西區
家五喵有限公司,新北市汐止區水源路1段190巷9號1樓,新北市,汐止區
底兒商品行,臺中市大里區中興路二段817號1樓、2樓,臺中市,大里區
汪福寵物美容商行,臺北市內湖區文德路208巷20號1樓,臺北市,內湖區
萬達寵物事業股份有限公司新雅分公司,新北市板橋區板橋區南雅南路1段40號1樓,新北市,板橋區
毛寶貝快樂寵物坊,新北市板橋區仁化街137號1樓,新北市,板橋區
花襪子的家寵物生活館,臺北市士林區天母北路38號1樓,臺北市,士林區
金錢貓旅宿,臺中市大甲區龍潭路61號1樓,臺中市,大甲區
淘狗有限公司,臺北市內湖區新明路298巷14弄9號一樓,臺北市,內湖區
老陸企業,高雄市左營區福山里榮總路513號,高雄市,左營區
嗚汪家寵物店,臺中市北屯區環太東路585號1樓,臺中市,北屯區
小毛宅寵物企業社,新北市淡水區新北市淡水區中山北路1段207巷9號,新北市,淡水區
秀狗兒寵物美容,新北市泰山區新北市泰山區明志路３段74巷1號及5號1樓,新北市,泰山區
萬達寵物事業股份有限公司北和分公司,臺北市北投區中和街59號1至4樓,臺北市,北投區
大小姐貓舍,臺北市大安區光復南路700號1樓,臺北市,大安區
快樂喵寵物企業社,桃園市桃園區文中里延壽街144號1樓,桃園市,桃園區
彩萌寵物會館,桃園市桃園區北埔路17巷40號,桃園市,桃園區
快樂寵物精品店,桃園市大園區大園里中山北路88號,桃園市,大園區
萬達寵物事業股份有限公司台南崑大分公司,臺南市永康區崑大路221、223、225號,臺南市,永康區
安心肉墊寵物澡堂,臺中市大里區長春路18號1樓,臺中市,大里區
吉比寵物精品店,新北市三重區新北市三重區力行路1段153巷2號,新北市,三重區
合歡寵物旅館,新北市三峽區溪東路233巷45弄28號1樓,新北市,三峽區
波士頓寵物美學社,臺中市大里區文心南路1316巷2號1樓,臺中市,大里區
捷秀有限公司,臺南市仁德區後壁里7鄰中正路二段224號1樓,臺南市,仁德區
達菲寵物沙龍,高雄市左營區至真路155號,高雄市,左營區
樂活寵物居家生活館,桃園市蘆竹區羊稠里中山北街89號,桃園市,蘆竹區
樂豪寵物貓舍,新北市板橋區中正路348號1樓,新北市,板橋區
醬心寵物旅行館,新北市蘆洲區新北市蘆洲區永平街32巷45弄14號,新北市,蘆洲區
得水集寵股份有限公司,臺北市文山區木柵路二段27號1樓,臺北市,文山區
貓遇貓寓商行,臺南市北區文賢路1122巷13號,臺南市,北區
森沐寵物會館,臺南市中西區成功路291號1樓,臺南市,中西區
萌萌貓企業社,臺南市東區東平路117號,臺南市,東區
寵牠寵物美容,新北市板橋區新北市板橋區德興街37巷16號1樓,新北市,板橋區
毛善有限公司,桃園市龜山區文化一路320號2樓,桃園市,龜山區
咪寵愛商行,高雄市三民區鼎中路170號1樓,高雄市,三民區
萬達寵物事業股份有限公司-頂溪分公司,新北市永和區中山路1段24號1樓,新北市,永和區
艾芠有限公司,臺北市中正區信陽街9號2樓,臺北市,中正區
淘氣族寵物用品店,高雄市三民區自立一路93號,高雄市,三民區
喵星人貓舍幼貓寵物店,新北市中和區中山路三段229巷1號1樓,新北市,中和區
黑丘寵物沙龍,臺南市仁德區後壁里19鄰德善路259號1樓,臺南市,仁德區
咘啦格寵物實業社,新北市土城區土城區中央路4段291號,新北市,土城區
派特餐飲有限公司,臺中市南屯區公益路二段959號之1號2樓,臺中市,南屯區
栗子狗寵物生活館,臺中市東區旱溪東路一段290之1號,臺中市,東區
菩鑫有限公司,高雄市左營區文府路75號1樓,高雄市,左營區
乙珍寵物美容精品百貨,高雄市大寮區進學路1-1號,高雄市,大寮區
萌旅寵物美容旅館,臺南市新市區大營里2鄰豐榮59之21號,臺南市,新市區
萬達寵物事業股份有限公司雙和分公司,新北市永和區中正路185號1樓,新北市,永和區
好寵企業有限公司,臺北市大安區信義路三段75-1號1、2樓,臺北市,大安區
有怪獸企業有限公司,臺中市西屯區市政北一路1號3樓,臺中市,西屯區
林水梨商行,新北市淡水區淡金路38巷33-20號1樓,新北市,淡水區
永樂健康有限公司永和營業所,新北市永和區福和路328及330號1樓,新北市,永和區
毛旅企業社,臺北市中山區台北市中山區長安東路二段232號一樓,臺北市,中山區
寵物家人企業行,高雄市三民區鼎山街276、278號,高雄市,三民區
萬里福田寵物城堡有限公司,臺北市中山區中山北路三段31號3樓,臺北市,中山區
嬌滴滴寵物園,高雄市前鎮區崗山中街50、52號,高雄市,前鎮區
就是愛寵物精品旅館,高雄市左營區新庄仔路409號1、2樓,高雄市,左營區
東森寵物雲股份有限公司小港宏平分公司,高雄市小港區宏平路432、434號,高雄市,小港區
欣薇達寵物精品沙龍,臺北市中山區長安東路二段228號,臺北市,中山區
萬達寵物事業股份有限公司興南分公司,新北市中和區興南路1段43號、45號1樓,新北市,中和區
高屋寵物股份有限公司,臺北市中山區敬業一路128巷8號1樓,臺北市,中山區
張羅企業社,臺北市士林區士東路18號1樓,臺北市,士林區
啵好寵物生活館,臺北市中山區北安路472號1樓,臺北市,中山區
咩皮鍋吉貓屋,高雄市左營區崇實里29鄰先勝路50號1樓,高雄市,左營區
貓掌櫃會館,高雄市前鎮區台鋁南巷8號,高雄市,前鎮區
萬達寵物事業股份有限公司新中分公司,新北市新店區中正路255號1樓,新北市,新店區
唯婕寵物沙龍,桃園市龜山區精忠里光峯路159號,桃園市,龜山區
寵愛有家寵物沙龍,新北市樹林區太平路63號1樓,新北市,樹林區
北歐三狗有限公司,臺北市松山區八德路三段224號1樓及2樓,臺北市,松山區
米古咪古寵物生活館,新北市三重區三重區仁義街347號1樓,新北市,三重區
大安旺旺愛犬屋有限公司,臺北市大安區復興南路一段321號6樓及6樓之2,臺北市,大安區
艾菲雅寵物美容,高雄市仁武區安樂一街169巷105之1號1、2樓,高雄市,仁武區
萬達寵物事業股份有限公司汐新分公司,新北市汐止區新興路3號1樓,新北市,汐止區
曉邑有限公司,臺中市南區有恆街146號4樓,臺中市,南區
周佳名犬屋,臺中市北區天津路二段150號1樓,臺中市,北區
明晞有限公司,臺中市北屯區北華街119號1樓及地下1樓,臺中市,北屯區
煦的幸福空間號,臺中市東區東光園路149號1樓、2樓,臺中市,東區
喵吉拉渡假村,臺北市中正區臺北市中正區金山北路1號13樓,臺北市,中正區
樹洞寵物旅店,臺南市善化區光文里19鄰民生路287號,臺南市,善化區
小苑子寵物美容,新北市板橋區民生路3段108號1樓,新北市,板橋區
魚中魚樂活有限公司八德分公司,桃園市八德區桃園市八德區茄明里中華路263-2號,桃園市,八德區
安宇寵物,桃園市蘆竹區大興八街91號1樓,桃園市,蘆竹區
幸福寵物生活館,臺北市信義區和平東路三段283號1樓,臺北市,信義區
台灣皇爵貿易股份有限公司,高雄市楠梓區後昌路811號1、2樓,高雄市,楠梓區
台灣皇爵貿易股份有限公司自由分公司,高雄市左營區自由三路250之1號,高雄市,左營區
旅行貓咪行,新北市汐止區鄉長路1段21號1樓,新北市,汐止區
漂亮寶貝愛犬美容專坊,高雄市鳳山區大明路128巷1號,高雄市,鳳山區
三中東區啦啦寶都股份有限公司(南館),臺中市東區進德路600號,臺中市,東區
東森寵物雲股份有限公司板橋雨農分公司,新北市板橋區新翠里雨農路54號1樓,新北市,板橋區
東森寵物雲股份有限公司新莊中正分公司,新北市新莊區新莊區中正路102、104號1樓,新北市,新莊區
寵曖狗狗生活館,臺中市中區民族路223號1樓、2樓,臺中市,中區
貓咪安心庇護工作坊,臺中市大里區東明路136號12樓之3,臺中市,大里區
查克音國際有限公司,臺中市西區臺灣大道二段311巷1弄30號1樓,臺中市,西區
東森寵物雲股份有限公司永和得和分公司,新北市永和區得和路409號1樓,新北市,永和區
日升寵物用品店,臺中市豐原區豐原大道一段257號,臺中市,豐原區
汪汪大師寵物店,臺南市東區府連路184號1樓,臺南市,東區
阿德里安實業有限公司,高雄市楠梓區德民路418號,高雄市,楠梓區
九窩寵物旅館,新北市板橋區長江路2段217巷2弄2號1樓,新北市,板橋區
米頡寵物美容,新北市三重區仁愛街709號1樓,新北市,三重區
忠心寵物美容生活館,高雄市三民區大福街239號,高雄市,三民區
熊愛洗寵物美容沙龍,臺中市南屯區忠勇路52-228號1樓,臺中市,南屯區
浴旺森林狗貓生活館,臺中市南屯區五權西路二段365號1樓,臺中市,南屯區
花沐寵物美容精品館,臺中市北屯區松竹路二段259號1樓,臺中市,北屯區
萬達寵物事業股份有限公司台中北屯分公司,臺中市北屯區北屯路279之2號,臺中市,北屯區
臻材有限公司,高雄市左營區華夏路1062號,高雄市,左營區
佳綵寵物精品工坊,臺中市南屯區大光街121號1樓,臺中市,南屯區
宿洗寵物工作室,臺中市清水區新興路142之1號,臺中市,清水區
愛波寵物工作坊,臺中市西屯區福科路910號1樓,臺中市,西屯區
踏踏貓生活館,臺中市大雅區雅環路二段26巷37號2樓之3,臺中市,大雅區
佳晟寵物美容旅館青埔店,桃園市中壢區洽溪里公園路二段250號,桃園市,中壢區
最愛高齡寵物服務企業社,臺中市清水區八德路四段80號,臺中市,清水區
東森寵物雲股份有限公司台南新市分公司,臺南市新市區新市里14鄰中正路365號,臺南市,新市區
米乓肉圓商行,臺中市西屯區西屯路三段宏福三巷2之10號1樓,臺中市,西屯區
毛澡盆寵物生活館,新北市中和區市民街2號1樓,新北市,中和區
撼寶寶寵物新生活館,高雄市楠梓區樂群路259號,高雄市,楠梓區
寵老闆寵物美容,高雄市小港區港平路98號,高雄市,小港區
寶妮寵物美容坊,新北市蘆洲區民義街22巷13號1樓,新北市,蘆洲區
萬達寵物事業股份有限公司台南安南分公司,臺南市安南區北安路三段179號,臺南市,安南區
長春商行,臺中市西屯區西屯路二段17之1號地下1樓,臺中市,西屯區
悠樂寵物有限公司,臺北市大同區平陽街25號1樓,臺北市,大同區
秐橙有限公司,臺北市中山區雙城街49巷9-6號1樓,臺北市,中山區
大爺股份有限公司寶湖分公司,臺北市內湖區民權東路六段166號1樓及2樓,臺北市,內湖區
